title,price,types,land,building,bed,bath,floor,certificate,location,secondary_location,url
HUNIAN MINIMALIS 185 JUTA DALAM PERUMAHAN DEKAT KAMPUS UMY,Rp 185.000.000,Rumah,60,30,2,1,1,HGB - Hak Guna Bangun,"Kasihan, Bantul Kab., Yogyakarta D.I.",Bangunjiwo Kasihan Bantul,https://www.olx.co.id/item/hunian-minimalis-185-juta-dalam-perumahan-dekat-kampus-umy-iid-866766239
Pesona Sadewa Perumahan Istimewa Harga Murah,Rp 484.000.006,Rumah,93,45,2,1,1,SHM - Sertifikat Hak Milik,"Kasihan, Bantul Kab., Yogyakarta D.I.",tamantirto kasihan bantul                                                                      No Wa : 082299467788,https://www.olx.co.id/item/minimalis-rumah-dekat-kota-yogyakarta-dalam-perumahan-pesona-sadewa-iid-866766120
"Kost Baru Mewah Murah dkt Kampus UMY, Alma Ata, Unjani &amp; BSI",Rp 2.000.000.000,Rumah,229,350,&gt;10,&gt;10,SHM - Sertifikat Hak Milik,SHM - Sertifikat Hak Milik,"Kasihan, Bantul Kab., Yogyakarta D.I.",Tamantirto Kasihan Bantul Yogyakarta,https://www.olx.co.id/item/dijual-rumah-kontrakan-murah-dekat-umy-jogjakartakode-e2605-iid-866765581
HUNIAN MINIMALIS 185 JUTA DALAM PERUMAHAN DEKAT KAMPUS UMY,Rp 185.000.000,Rumah,60,30,2,1,1,HGB - Hak Guna Bangun,"Kasihan, Bantul Kab., Yogyakarta D.I.",Bangunjiwo Kasihan Bantul,https://www.olx.co.id/item/hunian-minimalis-185-juta-dalam-perumahan-dekat-kampus-umy-iid-866765077
MINIMALIS MODERN DI TENGAH KOTA BANTUL - SMR 244,Rp 395.000.000,Rumah,84,50,2,1,1,SHM - Sertifikat Hak Milik,"Sewon, Bantul Kab., Yogyakarta D.I.",Trirenggo Sewon Bantul,https://www.olx.co.id/item/smr-244-minimalis-modern-di-tengah-kota-bantul-iid-866764840
Cluster Minimalis Dekat Kampus UMY Lingkungan Nasionalis,Rp 400.000.000,Rumah,79,45,2,1,1,SHM - Sertifikat Hak Milik,"Kasihan, Bantul Kab., Yogyakarta D.I.",Sribitan Bangunjiwo Kasihan Bantul,https://www.olx.co.id/item/rumah-murah-selatan-kampus-umy-iid-866762474
Rumah kos ecclusive dua lantai dekat kmpus umy,Rp 1.600.000.000,Rumah,155,177,4,3,3,SHM - Sertifikat Hak Milik,"Kasihan, Bantul Kab., Yogyakarta D.I.","58FM+42M Tamantirto, Kabupaten Bantul, Daerah Istimewa Yogyakarta",https://www.olx.co.id/item/dijual-rumah-3-lantai-dalam-proses-finishing-selatan-kampus-umy-iid-866760715
Rumah dijual jogja proses bangun di Bangunjiwo Kasihan Bantul Yogya,Rp 266.000.000,Rumah,65,36,2,1,1,SHM - Sertifikat Hak Milik,"Kasihan, Bantul Kab., Yogyakarta D.I.","Lemahdadi, Bangunjiwo, Kasihan, Bantul, DI Yogyakarta (sekitar 10 menit dari kampus UMY Kasihan Bantul Yogyakarta) (hubungi kami: 0813 2717 9926)",https://www.olx.co.id/item/rumah-dijual-jogja-proses-finishing-di-bangunjiwo-kasihan-bantul-yogya-iid-866756155
"DP BISA 10%, CASH DISKON 20 JUTA KPR DISKON 10 JUTA",Rp 357.412.357,Rumah,78,45,2,1,1,SHM - Sertifikat Hak Milik,"Pajangan, Bantul Kab., Yogyakarta D.I.",yogyakarta selatan - bantul,https://www.olx.co.id/item/mewah-bisa-kpr-dp-10-cuma-12-unit-iid-866755550
Jual cepat rumah dekat kampus isi sewon bantul,Rp 235.000.000,Rumah,65,50,2,1,1,SHM - Sertifikat Hak Milik,"Sewon, Bantul Kab., Yogyakarta D.I.",Panggongharjo sewon bantul,https://www.olx.co.id/item/jual-cepat-rumah-murah-dekat-rrd-selatan-utara-kampus-isi-sewon-iid-866753898
Rumah 2 Lantai Dalam Ringroad Barat,Rp 700.000.000,Rumah,106,60,3,2,2,SHM - Sertifikat Hak Milik,"Kasihan, Bantul Kab., Yogyakarta D.I.","Tugu Lilin, Bangunjiwo, BantulInfo Lanjut Bisa Whatsapp ke 082313728668",https://www.olx.co.id/item/rumah-murah-2-lt-dekat-ringroad-selatan-jogja-iid-866751554
Bonus Kanopi dan Pagar Cluster Modern di Kasihan,Rp 500.000.000,Rumah,95,45,2,1,1,SHM - Sertifikat Hak Milik,"Kasihan, Bantul Kab., Yogyakarta D.I.",tamantirto kasihan bantul.                                             No Wa : 082299467788,https://www.olx.co.id/item/dijual-murah-rumah-bonus-pagar-dan-kanopi-iid-866751378
Rumah Siap Bangun dlm Perum Di Bangunjiwo Selatan UMY,Rp 350.000.000,Rumah,121,45,2,1,1,SHM - Sertifikat Hak Milik,"Kasihan, Bantul Kab., Yogyakarta D.I.","Notawang, Bangunjiwo, Kasihan, Bantul Whatsapp 081325659531",https://www.olx.co.id/item/rumah-minimalis-dekat-umy-harga-300-jt-an-iid-866749577
Rumah 2 Lantai Dalam Ringroad Barat,Rp 700.000.000,Rumah,103,60,3,2,2,SHM - Sertifikat Hak Milik,"Kasihan, Bantul Kab., Yogyakarta D.I.","Tugu Lilin, Bangunjiwo, BantulInfo Lanjut Bisa Whatsapp ke 082313728668",https://www.olx.co.id/item/rumah-murah-2-lt-dekat-ringroad-selatan-jogja-iid-866749011
Rumah 2 LT Strategis Dekat Ringroad Selatan,Rp 337.000.291,Rumah,80,37,2,1,1,SHM - Sertifikat Hak Milik,"Kasihan, Bantul Kab., Yogyakarta D.I.","Notawang, Bangunjiwo, Kasihan, Bantul Whatsapp 081325659531",https://www.olx.co.id/item/rumah-2-lt-strategis-dekat-ringroad-selatan-iid-866748662
"Dijual Griya Jipangan Lingkungan Asri Kawasan Bangunjiwo, Bantul",Rp 325.000.000,Rumah,80,40,2,1,1,SHM - Sertifikat Hak Milik,"Kasihan, Bantul Kab., Yogyakarta D.I.","Perumahan Griya Jipangan Asri 1, Dusun Jipangan, Bangunjiwo, Kasihan, Bantul, D.I. Yogyakarta (Jalan Bantul KM 8 masuk ke barat 7 menit) - Kontak Whatsapp = 0822 2333 8557",https://www.olx.co.id/item/dijual-3-unit-rumah-minimalis-di-griya-jipangan-asri-1-bangunjiwo-iid-866746581
Dijual 1 Unit Rumah Siap Bangun di Bangunjiwo Type 40/85 Rp 330 juta,Rp 330.000.608,Rumah,85,40,2,1,1,SHM - Sertifikat Hak Milik,"Kasihan, Bantul Kab., Yogyakarta D.I.","Griya Jipangan Asri 1, Dusun Jipangan, Bangunjiwo, Kasihan, Bantul, DIY (Jalan Bantul KM 8 masuk ke barat 7 menit) - Kontak Whatsapp : 0822 2333 8557",https://www.olx.co.id/item/jual-1-unit-rumah-siap-bangun-type-4085-rp-330-juta-di-bangunjiwo-iid-866745749
Rumah Siap Bangun dlm Perum Di Bangunjiwo Selatan UMY,Rp 350.000.000,Rumah,140,45,2,1,1,SHM - Sertifikat Hak Milik,"Kasihan, Bantul Kab., Yogyakarta D.I.","Notawang, Bangunjiwo, Kasihan, Bantul Whatsapp 081325659531",https://www.olx.co.id/item/rumah-minimalis-dekat-umy-harga-300-jt-an-iid-866744316
Kode : RSH 3268 #Rumah Cantik 2 Lantai Strategis Dalam Ringroad Sewon,Rp 900.000.000,Rumah,103,60,3,2,2,SHM - Sertifikat Hak Milik,"Kasihan, Bantul Kab., Yogyakarta D.I.","(Tugu Lilin) Gg Nakula, Ngingas, Ngentak, Bantul, Daerah Istimewa Yogyakarta 081325659531Info Lanjut Bisa Whatsapp ke 081325659531",https://www.olx.co.id/item/rumah-2-lantai-strategis-dekat-ringroad-selatan-harga-murah-iid-866743173
RUMAH MURAH SEKALI 2 LANTAI DI DEKAT RINGROAD &amp; KAMPUS UMY. JK10183,Rp 280.000.003,Rumah,80,37,2,1,1,SHM - Sertifikat Hak Milik,"Kasihan, Bantul Kab., Yogyakarta D.I.","Notawang, Bangunjiwo, Kasihan, Bantul Whatsapp 081325659531",https://www.olx.co.id/item/rumah-2-lt-minimalis-dekat-kampus-umy-iid-866742334
Rumah Dekat Kampus UMY di Lemahabang Bangunjiwo Siap Huni,Rp 435.000.003,,107,67,2,1,0,,"Kasihan, Bantul Kab., Yogyakarta D.I.",,https://www.olx.co.id/item/rumah-dekat-kampus-umy-di-lemahabang-bangunjiwo-siap-huni-iid-866742301
Kode : RSH 3261 #Rumah Cantik Modern Minimalis Dalam Perum Kasihan Ban,Rp 850.000.000,Rumah,90,50,2,1,,HGB - Hak Guna Bangun,"Kasihan, Bantul Kab., Yogyakarta D.I.","58JM+W37, Brajan, Tamantirto, Kec. Kasihan, Kabupaten Bantul, Daerah Istimewa Yogyakarta 55184",https://www.olx.co.id/item/rumah-design-minimalis-modern-lokasi-strategis-kasihan-bantul-iid-866742206
Dijual 3 Kavling Rumah Minimalis Siap Bangun di Bangunjiwo Bantul,Rp 320.000.140,Rumah,87,36,2,1,1,SHM - Sertifikat Hak Milik,"Kasihan, Bantul Kab., Yogyakarta D.I.","Griya Jipangan Asri 2, Dusun Jipangan, Kelurahan Bangunjiwo, Kecamatan Kasihan, Bantul, DIY (Jalan Bantul KM 8 masuk ke barat 7 menit) - Nomor WA = 0822-2333-8557",https://www.olx.co.id/item/dijual-4-kavling-rumah-siap-bangun-di-kasihan-harga-mulai-rp-305-juta-iid-866742122
Dijual Rumah Santai Asri Nyaman Perumahan Utara Tugu Lilin Bangunjiwo,Rp 500.000.000,Rumah,82,46,2,1,,SHM - Sertifikat Hak Milik,"Kasihan, Bantul Kab., Yogyakarta D.I.","5877+QV Bangunjiwo, Kabupaten Bantul, Daerah Istimewa Yogyakarta",https://www.olx.co.id/item/rumah-dalam-cluster-suasana-asri-dan-nyaman-kawasan-bangunjiwo-iid-866741967
Jual Rumah Siap Bangun Type 40/86 Rp 327 juta di Bantul dekat Kasongan,Rp 327.000.508,Rumah,86,40,2,1,1,SHM - Sertifikat Hak Milik,"Kasihan, Bantul Kab., Yogyakarta D.I.","Griya Jipangan Asri 2, Dusun Jipangan, Bangunjiwo, Kasihan, Bantul, DIY (Jalan Bantul KM 8 masuk ke barat 7 menit) ~ Kontak person : 0822 2333 8557 (Whatsapp Only)",https://www.olx.co.id/item/dijual-hunian-siap-bangun-type-4086-rp-327-juta-di-dekat-kasongan-iid-866741516
Jual Rumah Siap Bangun Type 45 + Tanah 84 m Rp 337 juta di Bangunjiwo,Rp 337.000.205,Rumah,84,45,2,1,1,SHM - Sertifikat Hak Milik,"Kasihan, Bantul Kab., Yogyakarta D.I.","Griya Jipangan Asri 2, Dusun Jipangan, Bangunjiwo, Kasihan, Bantul, D.I. Yogyakarta - No. Whatsapp = 0822-2333-8557",https://www.olx.co.id/item/dijual-hunian-siap-bangun-type-4584-rp-337-di-barat-jalan-bantul-km-8-iid-866740397
"DISKON BELASAN SAMPAI PULUHAN JUTA, BISA KPR",Rp 359.357.359,Rumah,81,45,2,1,1,SHM - Sertifikat Hak Milik,"Sewon, Bantul Kab., Yogyakarta D.I.",tugu gentong - coklat monggo bangunjiwo,https://www.olx.co.id/item/khusus-pembelian-2-unit-pertama-diskon-belasan-sampai-puluhan-juta-iid-866740211
RUMAH MURAH BONUS PERABOTAN LENGKAP DEKAT JL TUGU GENTONG. JK10386,Rp 390.000.006,Rumah,74,45,2,1,1,SHM - Sertifikat Hak Milik,"Kasihan, Bantul Kab., Yogyakarta D.I.",bangunjiwo - tugu gentong,https://www.olx.co.id/item/tepi-jalan-aspal-tugu-gentong-bangunjiwo-barat-lapangan-kasihan-iid-866739720
"Jual Rumah Type 45/93 Rp 353 Juta di Griya Jipangan Asri 2, Bangunjiwo",Rp 353.000.701,Rumah,93,45,2,1,1,SHM - Sertifikat Hak Milik,"Kasihan, Bantul Kab., Yogyakarta D.I.","Dusun Jipangan, Kelurahan Bangunjiwo, Kecamatan Kasihan, Kabupaten Bantul, D.I. Yogyakarta (Griya Jipangan Asri 2) - Kontak Whatsapp = 0822*2333*8557",https://www.olx.co.id/item/jual-rumah-siap-bangun-type-4593-rp-353-juta-di-griya-jipangan-asri-2-iid-866739607
Dijual Rumah Jogja Limasan Jawa,Rp 650.000.000,Rumah,106,60,3,2,2,SHM - Sertifikat Hak Milik,"Kasihan, Bantul Kab., Yogyakarta D.I.","Tugu Lilin, Bangunjiwo, BantulInfo Lanjut Bisa Whatsapp ke 082313728668",https://www.olx.co.id/item/rumah-murah-2-lt-dekat-kampus-alma-ata-kasihan-iid-866738559
"Selangkah Menuju Kampus UMY,Rumah Murah Kasihan",Rp 486.000.003,Rumah,105,50,2,1,1,SHM - Sertifikat Hak Milik,"Kasihan, Bantul Kab., Yogyakarta D.I.","Bangunjiwo, Kasihan, Bantul Yogyakarta",https://www.olx.co.id/item/perumahan-cantik-asri-dan-murah-dekat-umy-jogja-iid-866737838
Rumah 2 Lantai Dalam Ringroad Barat,Rp 700.000.000,Rumah,106,60,3,2,2,SHM - Sertifikat Hak Milik,"Kasihan, Bantul Kab., Yogyakarta D.I.","Tugu Lilin, Bangunjiwo, BantulInfo Lanjut Bisa Whatsapp ke 082313728668",https://www.olx.co.id/item/rumah-murah-2-lt-dekat-ringroad-selatan-jogja-iid-866737525
Rumah Siap Bangun dlm Perum Di Bangunjiwo Selatan UMY,Rp 350.000.000,Rumah,119,45,2,1,1,SHM - Sertifikat Hak Milik,"Kasihan, Bantul Kab., Yogyakarta D.I.","Notawang, Bangunjiwo, Kasihan, Bantul Whatsapp 081325659531",https://www.olx.co.id/item/rumah-minimalis-dekat-umy-harga-300-jt-an-iid-866737098
Rumah di Bangunjiwo Kasihan Bantul dekat Kampus UMY Siap Huni,Rp 360.000.004,Rumah,101,46,2,1,1,SHM - Sertifikat Hak Milik,"Kasihan, Bantul Kab., Yogyakarta D.I.","Lemahdadi, Bangunjiwo, Bantul, Jogja",https://www.olx.co.id/item/rumah-di-bangunjiwo-kasihan-bantul-dekat-kampus-umy-ramai-pemukiman-iid-866736720
Jual rumah siap huni barat kampus ISI Sewon Bantul,Rp 650.000.000,Rumah,70,50,2,2,2,SHM - Sertifikat Hak Milik,"Sewon, Bantul Kab., Yogyakarta D.I.","Gabusan,  trirenggo,  bantul, yogyakarta",https://www.olx.co.id/item/rumah-2-lantai-di-sewon-bantul-660-juta-dekat-kampus-isi-jogjakarta-iid-866736312
Rumah 320 juta dlm proses di pajangan bantul dekat masjid agung,Rp 320.000.100,Rumah,80,50,2,1,1,SHM - Sertifikat Hak Milik,"Pajangan, Bantul Kab., Yogyakarta D.I.","Kembanggede, Guwosari, Pajangan, Bantul",https://www.olx.co.id/item/rumah-dekat-kota-bantul-di-kembanggede-pajangan-bantul-proses-bangun-iid-866736139
"Hunian Jogja Grand Bangunjiwo, Dijual Cepat 300 Jt-an",Rp 375.000.000,Rumah,123,45,2,1,1,SHM - Sertifikat Hak Milik,"Kasihan, Bantul Kab., Yogyakarta D.I.","Notawang, Bangunjiwo, Kasihan, Bantul Whatsapp 081325659531",https://www.olx.co.id/item/rumah-siap-bangun-lokasi-bangunjiwo-300-jt-an-iid-866735388
Dijual Rumah Jogja Limasan Jawa,Rp 650.000.000,Rumah,103,60,3,2,2,SHM - Sertifikat Hak Milik,"Kasihan, Bantul Kab., Yogyakarta D.I.","Tugu Lilin, Bangunjiwo, BantulInfo Lanjut Bisa Whatsapp ke 082313728668",https://www.olx.co.id/item/rumah-murah-2-lt-dekat-kampus-alma-ata-kasihan-iid-866735018
Rumah Minimalis dkt Kampus STPN dan Mirota Jl. Godean dlm Ringroad,Rp 1.700.000.020,Rumah,208,150,5,4,2,HGB - Hak Guna Bangun,"Kasihan, Bantul Kab., Yogyakarta D.I.",Jl Godean Jogja,https://www.olx.co.id/item/rumah-minimalis-di-jl-godean-dlm-ringroad-iid-866734767
"Hunian Jogja Grand Bangunjiwo, Dijual Cepat 300 Jt-an",Rp 375.000.000,Rumah,121,45,2,1,1,SHM - Sertifikat Hak Milik,"Kasihan, Bantul Kab., Yogyakarta D.I.","Notawang, Bangunjiwo, Kasihan, Bantul Whatsapp 081325659531",https://www.olx.co.id/item/rumah-siap-bangun-lokasi-bangunjiwo-300-jt-an-iid-866734087
Rumah dekat gapura kasongan pasar niten 7menit ke ISI dan puasat kota,Rp 385.000.000,Rumah,100,45,2,1,1,SHM - Sertifikat Hak Milik,"Kasihan, Bantul Kab., Yogyakarta D.I.","Perumahan Kasongan Mansion, Kalongan RT.08, Kajen, Bangunjiwo, Bantul",https://www.olx.co.id/item/miliki-rumah-di-kasihan-bantul-dekat-pasar-niten-bantul-iid-866733510
Rumah di Bangunjiwo Kasihan Bnatul dekat Kampus UMY Harga 300jutaan,Rp 360.000.007,Rumah,81,45,2,1,1,SHM - Sertifikat Hak Milik,"Kasihan, Bantul Kab., Yogyakarta D.I.","Kalangan, Bangunjiwo, Kasihan, Bantul",https://www.olx.co.id/item/miliki-rumah-di-kasihan-bnatul-dekat-calon-uin-yogyakarta-iid-866733121
Rumah Dekat UMY di Jl Bantul KM 8 Proses Bangun,Rp 350.000.002,,80,45,2,1,0,,"Sewon, Bantul Kab., Yogyakarta D.I.",,https://www.olx.co.id/item/rumah-dekat-umy-di-jl-bantul-km-8-proses-bangun-iid-866733112
Rumah 285 juta nego dekat kampus UMY bangunjiwo kasihan bantul,Rp 285.000.090,Rumah,76,48,2,1,1,SHM - Sertifikat Hak Milik,"Kasihan, Bantul Kab., Yogyakarta D.I.",Donotirto Bangunjiwo Kasihan Bantul,https://www.olx.co.id/item/rumah-di-bangunjiwo-bantul-kota-dekat-kampus-umy-harga-200jutaan-nego-iid-866732474
Dijual Rumah Luas dekat Kampus UMY,Rp 575.000.000,Rumah,100,100,3,2,1,SHM - Sertifikat Hak Milik,"Kasihan, Bantul Kab., Yogyakarta D.I.","Perumahan Bumi Tirtonirmolo Indah 2 blok D2. Dusun Njeblog, desa Tirtonirmolo, kec.kasihan, kab.Bantul, Yogyakarta",https://www.olx.co.id/item/dijual-rumah-luas-murah-masuk-area-perumahan-dekat-univ-pgri-umy-iid-866730867
Hunian Di Bantul Kota Mulai 300 Jutaan Dekat Kampus ISI Kasongan Sewon,Rp 330.000.000,Rumah,70,45,2,2,1,SHM - Sertifikat Hak Milik,"Sewon, Bantul Kab., Yogyakarta D.I.",Kandang Sewon Bantul Yogyakarta,https://www.olx.co.id/item/kode-rsb-7-rumah-prose-finising-di-dekat-smp-1-sewon-bantul-yogyakar-iid-866729721
"Orizya Estate Sedayu, Hunian Asri dekat Universitas Mercubuana YGY",Rp 379.000.000,,82,46,2,1,0,,"Pajangan, Bantul Kab., Yogyakarta D.I.",,https://www.olx.co.id/item/rumah-dekat-mercubuana-di-jl-wates-km-12-sedayu-bantul-siap-bangun-iid-866728992
Rumah Baru Jalan Bantul Pendowoharjo 2 Lantai,Rp 500.000.000,Rumah,105,70,3,2,1,SHM - Sertifikat Hak Milik,"Sewon, Bantul Kab., Yogyakarta D.I.",Jln imogiri barat,https://www.olx.co.id/item/rumah-shm-proses-bangun-dekat-jln-imogori-barat-sangat-strategis-iid-866725386
Jual rumah di perumahan perwita regency,Rp 1.500.000.000,Rumah,120,90,2,1,1,SHM - Sertifikat Hak Milik,"Sewon, Bantul Kab., Yogyakarta D.I.",Jl prangtritis km 2 sewon bantul yogyakarta,https://www.olx.co.id/item/jual-rumah-di-perumahan-perwita-regency-iid-843260013
Rumah dijual perum pondok permai tamantirta dekat UMY,Rp 1.450.000.000,,145,100,3,2,0,,"Kasihan, Bantul Kab., Yogyakarta D.I.",,https://www.olx.co.id/item/rumah-dijual-dalam-perum-pondok-permai-tamantirta-dekat-kampus-umy-iid-866723699
Rumah dekat UMY di perum pondok permai tamantirta,Rp 1.450.000.000,,145,90,3,2,0,,"Kasihan, Bantul Kab., Yogyakarta D.I.",,https://www.olx.co.id/item/rumah-luas-di-perum-pondok-permai-tamantirta-dekat-umy-iid-866723579
Villa Kolam Renang Asri Pepohonan Jogja Selatan,Rp 4.000.000.000,Rumah,461,250,5,3,1,SHM - Sertifikat Hak Milik,"Kasihan, Bantul Kab., Yogyakarta D.I.","Bangunjiwo, kasihan, bantul",https://www.olx.co.id/item/villa-dengan-kolam-renang-pribadi-di-bangunjiwo-iid-832851130
Rumah cantik lingkungan perumahan imogiri barat sangat nyaman sekali,Rp 825.000.000,Rumah,119,54,2,1,,SHM - Sertifikat Hak Milik,"Sewon, Bantul Kab., Yogyakarta D.I.",Jalan imogiri barat KM 7.5,https://www.olx.co.id/item/rumah-siap-huni-dalam-perumahan-jalan-imogiri-barat-km-75-strategis-iid-832765462
Dijual Rumah Induk +Kost 17 kmr dkt Kampus ISI,Rp 2.250.000.000,Rumah,495,300,&gt;10,8,1,SHM - Sertifikat Hak Milik,"Sewon, Bantul Kab., Yogyakarta D.I.","Ngireng-ireng, Panggungharjo, Sewon, Bantul",https://www.olx.co.id/item/rumah-indukkost-cantik-menarik-di-sewon-selangkah-saja-ke-kampus-isi-iid-866715496
"Rumah dijual, mewah dalam ringroad",Rp 1.200.000.000,,236,236,3,2,0,,"Kasihan, Bantul Kab., Yogyakarta D.I.",,https://www.olx.co.id/item/rumah-dijual-mewah-dalam-ringroad-iid-866682973
Rumah plus tempat usaha panjatan,Rp 475.000.000,Rumah,70,70,3,2,2,SHM - Sertifikat Hak Milik,"Wates, Kulon Progo Kab., Yogyakarta D.I.",Perum Sinar Giri peni Blok C.no 17.giri peni watesKulon Progo.,https://www.olx.co.id/item/jual-rumah-perum-sinar-giri-nego-iid-867112525
Tanah Kavling Murah Dekat Dengan Bandara Baru YIA Kulon Progo,Rp 125.000.000,Rumah,89,89,2,1,1,SHM - Sertifikat Hak Milik,"Wates, Kulon Progo Kab., Yogyakarta D.I.","Dobangsan, Girpeni, Wates, Kulon Progo, Yogyakarta",https://www.olx.co.id/item/tanah-kavling-mura-iid-867090983
"Tanah Dijual Area Industri Sentolo, Jogja. Cocok Investasi Kontrakan",Rp 168.000.000,Rumah,69,30,2,1,1,HGB - Hak Guna Bangun,"Wates, Kulon Progo Kab., Yogyakarta D.I.",giripeni wates kulon progo jalan sentolo purworejo,https://www.olx.co.id/item/rumah-baru-siap-huni-jalan-sentolo-purworejo-dekat-kota-wates-iid-867089240
Tanah Kavling Strategia,Rp 133.000.000,Rumah,68,30,2,1,1,HGB - Hak Guna Bangun,"Wates, Kulon Progo Kab., Yogyakarta D.I.",jalan jogja wates giripeni wates kulon progo,https://www.olx.co.id/item/rumah-jalan-jogja-wates-giripeni-wates-kulon-progo-dekat-kota-iid-867088529
DIJUAL MURAH rumah siap huni dekat jl.Sentolo kulonprogo.1313,Rp 475.000.000,,200,70,3,1,0,,"Pengasih, Kulon Progo Kab., Yogyakarta D.I.",,https://www.olx.co.id/item/kode-rsh-3293-rumah-cantik-murah-siap-huni-di-pengasih-kulon-progo-iid-867023013
Rumah Modern Lingkungan Ramai 13 KM Bandara YIA,Rp 293.700.000,Rumah,132,40,2,1,1,SHM - Sertifikat Hak Milik,"Pengasih, Kulon Progo Kab., Yogyakarta D.I.","Jl. KRT Kertodiningrat, Kulonprogo (Gn Gondang, Margosari, Dekat Janabadra Pengasih)",https://www.olx.co.id/item/rumah-modern-lingkungan-ramai-13-km-bandara-yia-iid-867016172
Rumah Panjatan Rumah Murah Asri Siap Huni di Kulonprogo Jogja,Rp 155.000.000,Rumah,60,30,2,1,1,SHM - Sertifikat Hak Milik,"Wates, Kulon Progo Kab., Yogyakarta D.I.",Dekat Jl. Raya Nangsri - Manisrenggo,https://www.olx.co.id/item/cuma-1-jutaan-per-bulan-rumah-modern-jogja-timur-iid-859689971
"Selatan Jl. Kawasan Industri, Tanah Sentolo Luasan 140m: SHM P",Rp 1.300.000,Rumah,124,125,3,2,1,SHM - Sertifikat Hak Milik,"Wates, Kulon Progo Kab., Yogyakarta D.I.",Jalan Kawasan Industri,https://www.olx.co.id/item/100-jt-an-kavling-kawasan-industri-sentolo-iid-865083780
Hunian Elite Sertifikat SHM Dekat Janabadra Pengasih,Rp 290.850.000,Rumah,131,40,2,1,0,SHM - Sertifikat Hak Milik,"Pengasih, Kulon Progo Kab., Yogyakarta D.I.","Pengasih, Kulonprogo (Gn Gondang, Margosari, Dekat Janabadra Pengasih)",https://www.olx.co.id/item/hunian-elite-sertifikat-shm-dekat-janabadra-pengasih-iid-866898609
Rumah Mewah Pinggir jln raya Cocok untuk INVESTASI dekat  Bandara NYIA,Rp 555.000.999,Rumah,127,55,3,1,,SHM - Sertifikat Hak Milik,"Pengasih, Kulon Progo Kab., Yogyakarta D.I.",Jl.Wates Ngramang Pengasih kulonprogo,https://www.olx.co.id/item/rumah-sangat-strategis-5meter-dari-jalan-raya-iid-866897073
Hunian Elite Area Pemukiman Padat Dekat Janabadra Wates,Rp 228.550.000,Rumah,94,36,2,1,0,SHM - Sertifikat Hak Milik,"Pengasih, Kulon Progo Kab., Yogyakarta D.I.","Jl. Pengasih, Banyuroto (Banyuroto, Barat Omah Cantrik)",https://www.olx.co.id/item/dijual-rumah-area-pemukiman-padat-dekat-raminten-resort-iid-866896543
Rumah strategis pinggir jln nasional 5 menit ke Bandara NYIA,Rp 550.000.002,Rumah,120,55,3,1,1,SHM - Sertifikat Hak Milik,"Pengasih, Kulon Progo Kab., Yogyakarta D.I.",jl purworejo jogja Ngramang KukonProgo Wates                                                                   .No Wa : 082299467788,https://www.olx.co.id/item/dijual-rumqh-di-kulon-progo15-menit-dari-bandara-nyia-iid-866846568
RUMAH SANGAT STRATEGIS 5METER DARI JALAN RAYA,Rp 580.000.959,Rumah,129,55,3,1,1,SHM - Sertifikat Hak Milik,"Pengasih, Kulon Progo Kab., Yogyakarta D.I.","Jl.Wates, Ngramang, Pengasih, Kulonprogo",https://www.olx.co.id/item/terbaik-di-kulonprogo-cluster-tepi-jalan-raya-iid-866825670
Rumah Mewah Pinggir jln raya Cocok untuk INVESTASI dekat  Bandara NYIA,Rp 555.000.999,Rumah,120,55,3,1,1,SHM - Sertifikat Hak Milik,"Pengasih, Kulon Progo Kab., Yogyakarta D.I.",Jl.Wates Ngramang Pengasih Kulonprogo,https://www.olx.co.id/item/rumah-idaman-pinggir-jalan-raya-nasional-dekat-bandara-iid-866825458
RUMAH SANGAT STRATEGIS 5METER DARI JALAN RAYA,Rp 580.000.959,Rumah,126,55,3,1,,SHM - Sertifikat Hak Milik,"Pengasih, Kulon Progo Kab., Yogyakarta D.I.","Jl.Wates Ngramang, Pengasih, Kulonprogo",https://www.olx.co.id/item/rumah-sangat-strategis-tepi-jalan-raya-dan-depan-spbu-iid-866825221
Rumah mewah akses mudah,Rp 275.000.000,Rumah,70,36,2,1,1,HGB - Hak Guna Bangun,"Wates, Kulon Progo Kab., Yogyakarta D.I.",Perumahan BSA 2 No 82 Njoho Gunung Gempal Giripeni Wates,https://www.olx.co.id/item/dijual-rumah-strategis-belakang-samsat-baru-iid-866815847
Rumah Dijual Lebar Depan Ideal Area Relokasi Pemda,Rp 296.700.000,Rumah,132,40,2,1,0,SHM - Sertifikat Hak Milik,"Pengasih, Kulon Progo Kab., Yogyakarta D.I.","Jalan KRT Kertodiningrat (Desa Margosari, Area Relokasi Pemda)",https://www.olx.co.id/item/rumah-dijual-lebar-depan-ideal-area-relokasi-pemda-iid-866760698
komplek perumahan dekat samsat dan polres kulonprogo jalan jogja wates,Rp 160.000.000,Rumah,59,30,2,1,1,HGB - Hak Guna Bangun,"Wates, Kulon Progo Kab., Yogyakarta D.I.",gripeni wates kulon progo,https://www.olx.co.id/item/rumah-diwates-kulon-progo-dekat-samsat-dan-polres-iid-866740785
Jasa bangun rumah terjangkau,Rp 126.000.000,Rumah,90,36,2,1,1,SHM - Sertifikat Hak Milik,"Wates, Kulon Progo Kab., Yogyakarta D.I.",Kulon progo yogyakarta,https://www.olx.co.id/item/jasa-bangun-rumah-harga-terjangkau-iid-824321069
Perum Griya Gondangdia di Kawasan Prospektif Kulon Progo,Rp 267.500.000,Rumah,72,36,2,1,1,SHM - Sertifikat Hak Milik,"Pengasih, Kulon Progo Kab., Yogyakarta D.I.","Pengasih, KUlon Progo, Yogyakarta",https://www.olx.co.id/item/perumahan-murah-bisa-kpr-akses-ke-bandara-baru-yogyakarta-iid-854639326
Rumah Dijual Lebar Depan Ideal Area Relokasi Pemda,Rp 292.200.000,Rumah,39,132,2,1,0,SHM - Sertifikat Hak Milik,"Pengasih, Kulon Progo Kab., Yogyakarta D.I.","Jalan KRT Kertodiningrat (Desa Margosari, Area Relokasi Pemda)",https://www.olx.co.id/item/rumah-dijual-lebar-depan-ideal-area-relokasi-pemda-iid-866729752
Rumah tepi Jalan Raya Nasional Wates 1menit dari Polres Kulonprogo,Rp 500.000.000,Rumah,130,55,3,1,1,SHM - Sertifikat Hak Milik,"Wates, Kulon Progo Kab., Yogyakarta D.I.",Ngramang Pengasih Kulonprogo,https://www.olx.co.id/item/rasakan-kemewahan-rumah-modern-pinggir-jalan-wates-iid-866673729
Rumah tepi Jalan Raya Nasional Wates 1menit dari Polres Kulonprogo,Rp 500.000.000,Rumah,130,55,3,1,,SHM - Sertifikat Hak Milik,"Wates, Kulon Progo Kab., Yogyakarta D.I.",Jl.Wates Ngramang Pengasih Kulonprogo,https://www.olx.co.id/item/terbaik-di-wates-cluster-tepi-jalan-nasional-wates-iid-866672736
"TERBAIK DI WATES, CLUSTER TEPI JALAN NASIONAL WATES",Rp 590.001.439,Rumah,125,55,3,1,1,SHM - Sertifikat Hak Milik,"Wates, Kulon Progo Kab., Yogyakarta D.I.",Depan SPBU Ngramang Pengasih Kulonprogo,https://www.olx.co.id/item/spesial-rumah-strategis-tepi-jalan-wates-iid-866672026
Dijual Hunian Idaman Strategis Hanya 200 Jutaan di Kulonprogo,Rp 225.000.000,Rumah,113,40,2,2,1,SHM - Sertifikat Hak Milik,"Pengasih, Kulon Progo Kab., Yogyakarta D.I.","Jl. Raya Wates  (Kali Kepek, Giri Peni, Selatan Perumahan ndalem Giri Peni)",https://www.olx.co.id/item/hunian-elite-area-pemukiman-padat-dekat-janabadra-wates-iid-866641944
rumah jalan jogja wates giripeni wates kulon progo dekat kota,Rp 160.000.000,Rumah,58,30,2,1,1,HGB - Hak Guna Bangun,"Wates, Kulon Progo Kab., Yogyakarta D.I.",giripeni wates kulon progo,https://www.olx.co.id/item/rumah-dijalan-jogja-wates-dalam-perumahan-dekat-kota-wates-iid-866636539
rumah diwates kulon progo dekat samsat dan polres,Rp 160.000.000,Rumah,59,30,2,1,0,HGB - Hak Guna Bangun,"Wates, Kulon Progo Kab., Yogyakarta D.I.",giri peni wates kulon progo,https://www.olx.co.id/item/komplek-perumahan-dekat-samsat-dan-polres-kulonprogo-jalan-jogja-wates-iid-866583377
Rumah istimewa pinggir jalan raya nasional,Rp 585.000.000,Rumah,135,55,3,1,1,SHM - Sertifikat Hak Milik,"Wates, Kulon Progo Kab., Yogyakarta D.I.",Jl.Wates Ngramang Pengasih Kulonprogo,https://www.olx.co.id/item/rumah-hunian-sangat-strategis-pinggir-jalan-wates-depan-spbu-iid-866495290
Tanah Kavling Murah Dekat Dengan Bandara Baru YIA Kulon Progo,Rp 125.000.000,Rumah,89,89,2,1,1,SHM - Sertifikat Hak Milik,"Wates, Kulon Progo Kab., Yogyakarta D.I.","Dobangsan, Giripeni, Wates, Kulon Progo, Yogyakarta",https://www.olx.co.id/item/tanah-kavling-strategia-iid-866447775
