title,price,types,land,building,bed,bath,floor,certificate,location,secondary_location,url
Rumah Proses Bangun Dekat Kampus UMY Harga Murah,Rp 850.000.324,Rumah,106,60,3,2,2,SHM - Sertifikat Hak Milik,"Umbulharjo, Yogyakarta Kota, Yogyakarta D.I.","Tugu Lilin, Bangunjiwo, BantulInfo Lanjut Bisa Whatsapp ke 082313728668",https://www.olx.co.id/item/rumah-minimalis-proses-bangun-2-lt-dekat-umy--iid-867227510
"Rumah Dekat UGM, SCH, UII",Rp 4.460.000.000,Rumah,305,399,5,5,2,HGB - Hak Guna Bangun,"Gondokusuman, Yogyakarta Kota, Yogyakarta D.I.","Ngaglik, Sleman, Yogyakarta (Tlp/WA -082137523862 -087739020909)",https://www.olx.co.id/item/rumah-dekat-uiiugmsch-iid-867227441
Rumah modern minimalis proses pembangunan purwomartani,Rp 1.200.000.000,Rumah,92,70,3,2,,SHM - Sertifikat Hak Milik,"Depok, Sleman Kab., Yogyakarta D.I.",Purwomartani,https://www.olx.co.id/item/rumah-modern-minimalis-di-purwomartani-iid-859915753
"Rumah Dekat UGM, MMTC, UTY",Rp 4.600.000.000,Rumah,997,503,8,5,1,SHM - Sertifikat Hak Milik,"Gondokusuman, Yogyakarta Kota, Yogyakarta D.I.","Mlati, Sleman, Yogyakarta (Tlp/WA -082137523862 -087739020909)",https://www.olx.co.id/item/rumah-dekat-uty-ugm-unisa-iid-867227338
RJMAH HOOK STRATEGIS DEMANGAN BARU JOGJA KOTA,Rp 3.900.000.000,Rumah,360,586,7,6,2,SHM - Sertifikat Hak Milik,"Gondokusuman, Yogyakarta Kota, Yogyakarta D.I.","Ngaglik, Sleman, Yogyakarta (Tlp/WA -082137523862 -087739020909)",https://www.olx.co.id/item/rumah-hook-jogja-dekat-ugm-iid-867226943
Rumah Murah  2 Lantai  di area Kota Gede dalam Ringroad  Jogja,Rp 950.000.000,Rumah,86,83,3,2,2,SHM - Sertifikat Hak Milik,"Mantrijeron, Yogyakarta Kota, Yogyakarta D.I.",Dalam ringroad,https://www.olx.co.id/item/rumah-2-lantai-dalam-kota-jogja-dekat-pusat-jogja-iid-867225789
Rumah Mewah Perum Elite Hyarta dkt Pogung UGM jl palagan km 7,Rp 4.900.000.000,Rumah,180,220,4,3,2,SHM - Sertifikat Hak Milik,"Depok, Sleman Kab., Yogyakarta D.I.",Fast Respon WA : 0813-9127-8889 / 0823-2337-4139,https://www.olx.co.id/item/rumah-mewah-perum-elite-hyarta-dkt-pogung-ugm-jl-palagan-km-7-iid-867223579
"Rumah Jogja, Dekat UPN, UGM",Rp 3.500.000.000,Rumah,250,400,6,4,2,SHM - Sertifikat Hak Milik,"Depok, Sleman Kab., Yogyakarta D.I.","Condongcatur Dekat UPN, Gejayan, UGM, UNY (Telpon/WA: 0819-0404-5055  instagran: @propertymart_jogja) SyHAfR",https://www.olx.co.id/item/rumah-mewah-fully-furnished-eropa-classic-condongcatur-dekat-upn-ugm-iid-867223490
Rumah Mewah Perum Hyarta Eco Village jl JOGJA-SOLO,Rp 4.500.000.000,Rumah,169,147,5,4,2,SHM - Sertifikat Hak Milik,"Depok, Sleman Kab., Yogyakarta D.I.",Fast Respon WA : 0813-9127-8889 / 0823-2337-4139,https://www.olx.co.id/item/rumah-mewah-perum-hyarta-eco-village-jl-jogja-solo-iid-867222297
"Turun Harga 5M jd 4,5M Rumah Perum Elite Casagrande dkt UPN",Rp 4.500.000.000,Rumah,284,233,4,4,2,SHM - Sertifikat Hak Milik,"Depok, Sleman Kab., Yogyakarta D.I.",Fast Respon WA : 0813-9127-8889 / 0823-2337-4139,https://www.olx.co.id/item/turun-harga-5m-jd-45m-rumah-perum-elite-casagrande-dkt-upn-iid-867222189
"Rumah Mewah Megah Maguwo dkt Jogja Bay,UNRIYO,AdiTv",Rp 3.250.000.000,Rumah,550,400,7,6,2,SHM - Sertifikat Hak Milik,"Depok, Sleman Kab., Yogyakarta D.I.",Fast Respon WA : 0813-9127-8889 / 0823-2337-4139,https://www.olx.co.id/item/rumah-mewah-megah-maguwo-dkt-jogja-bayunriyoaditv-iid-867221550
"Rumah Mewah Perum Elite Barat Tugu jogja,10mnt UGM",Rp 4.500.000.000,Rumah,320,200,5,4,2,SHM - Sertifikat Hak Milik,"Depok, Sleman Kab., Yogyakarta D.I.",Fast Respon WA : 0813-9127-8889 / 0823-2337-4139,https://www.olx.co.id/item/rumah-mewah-perum-elite-barat-tugu-jogja10mnt-ugm-iid-867220973
Rumah Mewah Cantik Perum Elite Citrasun Garden jl Jogja-solo,Rp 3.800.000.000,Rumah,180,250,4,3,2,SHM - Sertifikat Hak Milik,"Depok, Sleman Kab., Yogyakarta D.I.",Fast Respon WA : 0813-9127-8889 / 0823-2337-4139,https://www.olx.co.id/item/rumah-mewah-perum-elite-citrasun-garden-iid-867220672
"Rumah Strategis cck Kost/Homestay Seturan dkt UPN,UAJY,AMikom,Ambarukm",Rp 3.200.000.000,Rumah,397,120,7,4,1,SHM - Sertifikat Hak Milik,"Depok, Sleman Kab., Yogyakarta D.I.",Fast Respon WA : 0813-9127-8889 / 0823-2337-4139,https://www.olx.co.id/item/rumah-strategis-cck-kosthomestay-seturan-dkt-upnuajyamikomambarukm-iid-867220106
"Turun HArga 3,9M jd 3,5M nego Rumah Mewah Perum Elite Bale Mulia dkt R",Rp 3.500.000.000,Rumah,210,250,5,4,2,SHM - Sertifikat Hak Milik,"Depok, Sleman Kab., Yogyakarta D.I.",Fast Respon WA : 0813-9127-8889 / 0823-2337-4139,https://www.olx.co.id/item/turun-harga-39m-jd-35m-nego-rumah-mewah-perum-elite-bale-mulia-dkt-r-iid-867220009
Rumah Hook di Perum Kodya Jogja Giwangan Umbulharjo Kota Jogja,Rp 696.000.000,Rumah,93,58,2,1,SHM - Sertifikat Hak Milik,SHM - Sertifikat Hak Milik,"Umbulharjo, Yogyakarta Kota, Yogyakarta D.I.",Umbulharjo Kodya,https://www.olx.co.id/item/rumah-hook-dlm-perum-kodya-di-giwangan-iid-866992181
Rumah Hitung Tanah Strategis Demangan cck Kost Exclusive dkt UGM UNY,Rp 3.900.000.000,Rumah,420,300,7,2,1,SHM - Sertifikat Hak Milik,"Depok, Sleman Kab., Yogyakarta D.I.",Fast Respon WA : 0813-9127-8889 / 0823-2337-4139,https://www.olx.co.id/item/rumah-hitung-tanah-strategis-demangan-cck-kost-exclusive-dkt-ugm-uny-iid-867219919
"Rumah Induk + Kost Exclusive 16kmr Strategis dkt UPN,Seturan",Rp 6.500.000.000,Rumah,534,580,10,10,2,SHM - Sertifikat Hak Milik,"Depok, Sleman Kab., Yogyakarta D.I.",Fast Respon WA : 0813-9127-8889 / 0823-2337-4139,https://www.olx.co.id/item/rumah-induk-kost-exclusive-16kmr-strategis-dkt-upnseturan-iid-867219599
"Kost Exclusive 15kt Mewah Strategis dkt UNY,UGM,Sanatadharma,Gejayan,H",Rp 5.870.000.000,Rumah,400,400,10,10,2,SHM - Sertifikat Hak Milik,"Depok, Sleman Kab., Yogyakarta D.I.",Fast Respon WA : 0813-9127-8889 / 0823-2337-4139,https://www.olx.co.id/item/kost-exclusive-15kt-mewah-strategis-dkt-unyugmsanatadharmagejayanh-iid-867219518
Rumah Kos 32 kmr strategis condongcatur,Rp 6.500.000.000,Rumah,522,878,10,10,2,SHM - Sertifikat Hak Milik,"Depok, Sleman Kab., Yogyakarta D.I.",Fast Respon WA : 0813-9127-8889 / 0823-2337-4139,https://www.olx.co.id/item/rumah-kos-32-kmr-strategis-condongcatur-iid-867219312
Rumah Minimalis Baru di Utara Jogja Bay Maguwoharjo,Rp 695.000.000,Rumah,97,65,3,2,1,SHM - Sertifikat Hak Milik,"Umbulharjo, Yogyakarta Kota, Yogyakarta D.I.",Yogyakarta,https://www.olx.co.id/item/rumah-baru-murah-minimalis-dekat-jogja-bay-iid-865379383
Kost Exclusive 11kt+Homestay dlm Ringroad dkt UGM,Rp 5.350.000.000,Rumah,251,355,10,10,2,SHM - Sertifikat Hak Milik,"Depok, Sleman Kab., Yogyakarta D.I.",Fast Respon WA : 0813-9127-8889 / 0823-2337-4139,https://www.olx.co.id/item/kost-exclusive-11kthomestay-dlm-ringroad-dkt-ugm-iid-867219194
"Rumah Mewah dlm Perum dkt JEC,RS HArdjoLukito Banguntapan",Rp 2.500.000.000,Rumah,130,180,4,3,2,SHM - Sertifikat Hak Milik,"Depok, Sleman Kab., Yogyakarta D.I.",Fast Respon WA : 0813-9127-8889 / 0823-2337-4139,https://www.olx.co.id/item/rumah-mewah-dlm-perum-dkt-jecrs-hardjolukito-banguntapan-iid-867219068
Dijual Rumah 2 LT Strategis Dekat Ringroad Selatan Bebas Balik Nama,Rp 1.150.000.312,Rumah,114,115,3,3,2,SHM - Sertifikat Hak Milik,"Wirobrajan, Yogyakarta Kota, Yogyakarta D.I.","Jagran, Gedongan, Bangunjiwo, Kasihan, BantulInfo Lanjut Bisa Whatsapp ke 082313728668",https://www.olx.co.id/item/dijual-rumah-2-lt-strategis-dekat-ringroad-selatan-bebas-balik-nama-iid-867218968
"Kost Eksklusif Exclusive 36kt 4 Lantai 5mnt Ke UII jl kaliurang km 13,",Rp 5.900.000.000,Rumah,303,1016,10,10,4,SHM - Sertifikat Hak Milik,"Depok, Sleman Kab., Yogyakarta D.I.",Fast Respon WA : 0813-9127-8889 / 0823-2337-4139,https://www.olx.co.id/item/kost-eksklusif-exclusive-36kt-4-lantai-5mnt-ke-uii-jl-kaliurang-km-13-iid-867218943
Jual tanah bonus rumah baciro kota lingkungan elit,Rp 2.500.000.000,Rumah,217,180,3,2,"Baciro, kodya",,"Gondokusuman, Yogyakarta Kota, Yogyakarta D.I.","Baciro, kodya",https://www.olx.co.id/item/tanah-bonus-rumah-kawasan-premium-di-baciro-iid-865625415
Rumah Murah Timoho Kota Yogyakarta Dalam Perumahan,Rp 2.750.000.000,Rumah,331,175,2,2,1,SHM - Sertifikat Hak Milik,"Gondokusuman, Yogyakarta Kota, Yogyakarta D.I.","KLITREN LOR GK 3/218, RT 63 RT 003",https://www.olx.co.id/item/rumah-di-gondokusuman-yogyakarta-woff832-1-iid-867218798
Kost murah dekat berbagai kampus dan kawasan bisnis seputaran Seturan,Rp 1.900.000.000,Rumah,186,150,10,10,2,SHM - Sertifikat Hak Milik,"Depok, Sleman Kab., Yogyakarta D.I.","Seturan,depok sleman",https://www.olx.co.id/item/rumah-kost-murah-10-kamar-di-seturan-iid-865673013
Banting harga rumah besar dlm perumahan di TAMANSISWA,Rp 2.800.000.000,Rumah,440,350,6,4,SHM - Sertifikat Hak Milik,SHM - Sertifikat Hak Milik,"Mergangsan, Yogyakarta Kota, Yogyakarta D.I.",Tamansiswa mergangsan kodya,https://www.olx.co.id/item/banting-harga-rumah-luas-dan-besar-dlm-kodya-di-perumahan-tamansiswa-iid-865703034
Rumah cantik 2lt perum elite jl kaliurang km 9 greenhills,Rp 2.500.000.000,Rumah,170,130,3,3,2,SHM - Sertifikat Hak Milik,"Depok, Sleman Kab., Yogyakarta D.I.",Fast Respon WA : 0813-9127-8889 / 0823-2337-4139,https://www.olx.co.id/item/rumah-cantik-2lt-perum-elite-jl-kaliurang-km-9-greenhills-iid-867218607
"Turun Harga 6M jd 4,9M nego Kost Exclusive 19kmr dkt STIE YKPN,UPN Set",Rp 4.900.000.000,Rumah,280,500,10,10,2,SHM - Sertifikat Hak Milik,"Depok, Sleman Kab., Yogyakarta D.I.",Fast Respon WA : 0813-9127-8889 / 0823-2337-4139,https://www.olx.co.id/item/turun-harga-6m-jd-49m-nego-kost-exclusive-19kmr-dkt-stie-ykpnupn-set-iid-867218396
Rumah Smart Home Strategis Jogja Barat Mulai 300Jt-an,Rp 300.000.000,Rumah,72,36,2,1,,SHM - Sertifikat Hak Milik,"Kotagede, Yogyakarta Kota, Yogyakarta D.I.",5 Menit ke SMA Pangudi Luhur Sedayu,https://www.olx.co.id/item/rumah-lokasi-strategis-di-jogja-barat-legalitas-komplit-iid-867218060
"Kost Exclusive BAru 24kt 24km FullFurnish FullPenghuni dkt UTY,RSA UGM",Rp 5.500.000.000,Rumah,393,600,10,10,2,SHM - Sertifikat Hak Milik,"Depok, Sleman Kab., Yogyakarta D.I.",Fast Respon WA : 0813-9127-8889 / 0823-2337-4139,https://www.olx.co.id/item/kost-exclusive-baru-24kt-24km-fullfurnish-fullpenghuni-dkt-utyrsa-ugm-iid-867217970
Rumah mewah istimewa perum Vasana dkt UGM jl kaliurang km 6,Rp 3.000.000.000,Rumah,160,200,4,3,2,SHM - Sertifikat Hak Milik,"Depok, Sleman Kab., Yogyakarta D.I.",Fast Respon WA : 0813-9127-8889 / 0823-2337-4139,https://www.olx.co.id/item/rumah-mewah-perum-jl-kaliurang-km-6-dkt-ugm-strategis-istimewa-iid-867217944
"Hostel Strategis Beroperasi Link Premium dkt UGM,RS Panti Rapih,Kota B",Rp 4.250.000.000,Rumah,71,200,10,10,2,SHM - Sertifikat Hak Milik,"Depok, Sleman Kab., Yogyakarta D.I.",Fast Respon WA : 0813-9127-8889 / 0823-2337-4139,https://www.olx.co.id/item/hostel-strategis-beroperasi-link-premium-dkt-ugmrs-panti-rapihkota-b-iid-867217389
"Kost 32kt 28km dlmr Ringroad dkt UPN,Ambarukmo Plaza,UAJY",Rp 5.000.000.000,Rumah,355,680,10,10,2,SHM - Sertifikat Hak Milik,"Depok, Sleman Kab., Yogyakarta D.I.",Fast Respon WA : 0813-9127-8889 / 0823-2337-4139,https://www.olx.co.id/item/kost-32kt-28km-dlmr-ringroad-dkt-upnambarukmo-plazauajy-iid-867217286
Rumah baru siap huni dalam ringroad dekat IKIP PGRI,Rp 725.000.000,Rumah,102,85,3,2,2,SHM - Sertifikat Hak Milik,"Ngampilan, Yogyakarta Kota, Yogyakarta D.I.","Jagran, Gedongan, Bangunjiwo, Kasihan, BantulInfo Lanjut Bisa Whatsapp ke 082313728668",https://www.olx.co.id/item/rumah-minimalis-siap-bangun-dekat-ringroad-selatan-iid-867217109
Rumah 2lt di perum Super Elit Jl Parangtritis Sewon Bantul,Rp 1.600.000.000,Rumah,200,180,4,3,2,SHM - Sertifikat Hak Milik,"Mergangsan, Yogyakarta Kota, Yogyakarta D.I.",Jalan parangtritis,https://www.olx.co.id/item/rumah-dlm-perum-elit-dlm-ringroad-di-jalan-parangtritis-iid-865849426
Rumah Mewah Cantik Perum Elite Greenhills jl kaliurang km 9,Rp 2.350.000.000,Rumah,165,90,3,2,2,SHM - Sertifikat Hak Milik,"Depok, Sleman Kab., Yogyakarta D.I.",Fast Respon WA : 0813-9127-8889 / 0823-2337-4139,https://www.olx.co.id/item/rumah-mewah-cantik-perum-elite-greenhills-jl-kaliurang-km-9-iid-867217001
Rumah Mewah Cantik Perum Elite Greenhills jl kaliurang km 9,Rp 2.350.000.000,Rumah,165,90,3,2,2,SHM - Sertifikat Hak Milik,"Depok, Sleman Kab., Yogyakarta D.I.",Fast Respon WA : 0813-9127-8889 / 0823-2337-4139,https://www.olx.co.id/item/rumah-mewah-cantik-perum-elite-greenhills-jl-kaliurang-km-9-iid-867217001
"Jual Kos 17 Kamar Lokasi Strategis Dkt UIN, UAD",Rp 4.250.000.000,Rumah,435,700,10,10,2,SHM - Sertifikat Hak Milik,"Depok, Sleman Kab., Yogyakarta D.I.",Fast Respon WA : 0813-9127-8889 / 0823-2337-4139,https://www.olx.co.id/item/jual-kos-17-kamar-lokasi-strategis-dkt-uin-uad-iid-867216971
Tanah  Strategis Dekat Kamus UMY Jogja,Rp 345.000.027,Rumah,89,37,2,1,1,SHM - Sertifikat Hak Milik,"Ngampilan, Yogyakarta Kota, Yogyakarta D.I.","Ngentak, Bangunjiwo, Kasihan, Bantul Info Lanjut Bisa Whatsapp ke 082313728668",https://www.olx.co.id/item/tanah-strategis-dekat-kamus-umy-jogja-iid-867216924
"Rumah Mewah 2lt Perum Elite Pondok Permai Kadipiro, dkt Malioboro,alun",Rp 2.300.000.000,Rumah,120,100,3,2,2,SHM - Sertifikat Hak Milik,"Depok, Sleman Kab., Yogyakarta D.I.",Fast Respon WA : 0813-9127-8889 / 0823-2337-4139,https://www.olx.co.id/item/rumah-mewah-2lt-perum-elite-pondok-permai-kadipiro-dkt-malioboroalun-iid-867216918
"Kost Exclusive 18 kmr Strategis Selangkah ke UAJY Babarsari,inc 40jt/b",Rp 4.500.000.000,Rumah,314,390,10,10,2,SHM - Sertifikat Hak Milik,"Depok, Sleman Kab., Yogyakarta D.I.",Fast Respon WA : 0813-9127-8889 / 0823-2337-4139,https://www.olx.co.id/item/kost-exclusive-18-kmr-strategis-selangkah-ke-uajy-babarsariinc-40jtb-iid-867216876
"BU Jual Cepat Rumah dlm Perum Kodya Jogja,Brontokusuman",Rp 2.500.000.000,Rumah,177,220,6,4,2,SHM - Sertifikat Hak Milik,"Depok, Sleman Kab., Yogyakarta D.I.",Fast Respon WA : 0813-9127-8889 / 0823-2337-4139,https://www.olx.co.id/item/bu-jual-cepat-rumah-dlm-perum-kodya-jogjabrontokusuman-iid-867216812
Selatan Kampus UMY Hanya sisa 4 Unit Rumah Siap Huni,Rp 488.000.344,Rumah,74,45,2,2,1,SHM - Sertifikat Hak Milik,"Wirobrajan, Yogyakarta Kota, Yogyakarta D.I.","Jagran, Gedongan, Bangunjiwo, Kasihan, BantulInfo Lanjut Bisa Whatsapp ke 082313728668",https://www.olx.co.id/item/dijual-rumah-minimalis-siap-huni-dekat-kampus-umy-iid-867216724
Rumah dijual dekat UGM di perumahan merapi view jakal km 9,Rp 2.100.000.000,Rumah,200,110,4,3,2,SHM - Sertifikat Hak Milik,"Depok, Sleman Kab., Yogyakarta D.I.","Jl. Kaliurang Km 9,5 Ngaglik, Sleman, Daerah Istimewa Yogyakarta",https://www.olx.co.id/item/rumah-2-lantai-include-kolam-renang-pribadi-di-jakal-dekat-merapi-view-iid-867216550
Rumah Baru Mewah Modern Minimalis Strategis dkt UPN Seturan,Rp 1.850.000.000,Rumah,111,170,5,3,2,SHM - Sertifikat Hak Milik,"Depok, Sleman Kab., Yogyakarta D.I.",Fast Respon WA : 0813-9127-8889 / 0823-2337-4139,https://www.olx.co.id/item/rumah-baru-mewah-modern-minimalis-strategis-dkt-upn-seturan-iid-867216493
"Kost Exclusive 16kt16km jl kaliurang km7 dkt UGM,BONUS UMROH",Rp 3.900.000.000,Rumah,253,300,10,10,2,SHM - Sertifikat Hak Milik,"Depok, Sleman Kab., Yogyakarta D.I.",Fast Respon WA : 0813-9127-8889 / 0823-2337-4139,https://www.olx.co.id/item/kost-exclusive-16kt16km-jl-kaliurang-km7-dkt-ugmbonus-umroh-iid-867216433
"Rumah Induk + 15kost Strategis jl palagan dkt Hyatt,UGM,Monjali",Rp 3.750.000.000,Rumah,498,510,10,10,2,SHM - Sertifikat Hak Milik,"Depok, Sleman Kab., Yogyakarta D.I.",Fast Respon WA : 0813-9127-8889 / 0823-2337-4139,https://www.olx.co.id/item/rumah-induk-15kost-strategis-jl-palagan-dkt-hyattugmmonjali-iid-867216216
Rumah Cantik Elegan dlm Perum Elite Citrasun Garden,Rp 2.800.000.000,Rumah,163,162,4,3,2,SHM - Sertifikat Hak Milik,"Depok, Sleman Kab., Yogyakarta D.I.",Fast Respon WA : 0813-9127-8889 / 0823-2337-4139,https://www.olx.co.id/item/rumah-cantik-elegan-dlm-perum-elite-citrasun-garden-iid-867216053
"Kost Exclusive income upto 22jt per bulan, Pogung dkt UGM dlm Ringroad",Rp 3.500.000.000,Rumah,195,299,10,10,2,SHM - Sertifikat Hak Milik,"Depok, Sleman Kab., Yogyakarta D.I.",Fast Respon WA : 0813-9127-8889 / 0823-2337-4139,https://www.olx.co.id/item/kost-exclusive-income-upto-22jt-per-bulan-pogung-dkt-ugm-dlm-ringroad-iid-867215977
Griya Perum Jalimtim Imogiri Timur Wonokromo Dkat Sultan Agung Jejeran,Rp 550.000.000,Rumah,81,52,2,1,1,SHM - Sertifikat Hak Milik,"Umbulharjo, Yogyakarta Kota, Yogyakarta D.I.","JL. Imogiri Timur, Banguntapan, Bantul, YK",https://www.olx.co.id/item/rumah-idaman-perumahan-dkt-jl-imogiri-barat-jejeran-jalimtim-bantul-iid-867215913
Rumah Modern Baru Elegan di Berbah,Rp 650.000.000,Rumah,45,75,2,1,1,SHM - Sertifikat Hak Milik,"Depok, Sleman Kab., Yogyakarta D.I.","Sembego, Maguwoharjo, Sleman Yogyakarta",https://www.olx.co.id/item/dijual-rumah-modern-iid-867215675
Kost Baru Exclusive Eksklusif 16kt 16km FullyFurnished Selangkah Ke UM,Rp 3.850.000.000,Rumah,252,300,10,10,2,SHM - Sertifikat Hak Milik,"Depok, Sleman Kab., Yogyakarta D.I.",Fast Respon WA : 0813-9127-8889 / 0823-2337-4139,https://www.olx.co.id/item/kost-baru-exclusive-eksklusif-16kt-16km-fullyfurnished-selangkah-ke-um-iid-867215357
Rumah Mewah Perum Elite Pondok Permai Kaliurang utara UGM,Rp 2.500.000.000,Rumah,129,131,4,3,2,SHM - Sertifikat Hak Milik,"Depok, Sleman Kab., Yogyakarta D.I.",Fast Respon WA : 0813-9127-8889 / 0823-2337-4139,https://www.olx.co.id/item/rumah-mewah-perum-elite-pondok-permai-kaliurang-utara-ugm-iid-867215341
Rumah Asri Lingkungan Apik di Conturi Estate Condongcatur,Rp 2.400.000.000,Rumah,255,196,4,4,2,SHM - Sertifikat Hak Milik,"Depok, Sleman Kab., Yogyakarta D.I.",Fast Respon WA : 0813-9127-8889 / 0823-2337-4139,https://www.olx.co.id/item/rumah-asri-lingkungan-apik-di-conturi-estate-condongcatur-iid-867214995
"Kost Exclusive Baru 10kt occupancy 99% dkt UPN,Seturan link Premium",Rp 3.500.000.000,Rumah,126,170,10,10,2,SHM - Sertifikat Hak Milik,"Depok, Sleman Kab., Yogyakarta D.I.",Fast Respon WA : 0813-9127-8889 / 0823-2337-4139,https://www.olx.co.id/item/kost-exclusive-baru-10kt-occupancy-99-dkt-upnseturan-link-premium-iid-867214796
Rumah Tinggal dan kost Sleman,Rp 1.750,Rumah,130,199,10,6,2,SHM - Sertifikat Hak Milik,"Umbulharjo, Yogyakarta Kota, Yogyakarta D.I.",Catur Tunggal Sleman,https://www.olx.co.id/item/rumah-tinggal-dan-kost-sleman-iid-867214556
"Rumah Mewah Perum Elite Vasana dkt UGM jl kaliurang km 6,5,FullyFurnis",Rp 2.750.000.000,Rumah,144,95,4,2,2,SHM - Sertifikat Hak Milik,"Depok, Sleman Kab., Yogyakarta D.I.",Fast Respon WA : 0813-9127-8889 / 0823-2337-4139,https://www.olx.co.id/item/rumah-mewah-perum-elite-vasana-dkt-ugm-jl-kaliurang-km-65fullyfurnis-iid-867214496
Rumah Mewah Pondok Permai Blok O Full Furnish 5mnt Ke Ambarukmo Plaza,Rp 2.100.000.000,Rumah,132,180,4,3,2,SHM - Sertifikat Hak Milik,"Depok, Sleman Kab., Yogyakarta D.I.",Fast Respon WA : 0813-9127-8889 / 0823-2337-4139,https://www.olx.co.id/item/rumah-mewah-pondok-permai-blok-o-full-furnish-5mnt-ke-ambarukmo-plaza-iid-867214368
Rumah dijual aman dekat Malioboro Jogja,Rp 890.000.000,Rumah,116,60,3,2,1,SHM - Sertifikat Hak Milik,"Wirobrajan, Yogyakarta Kota, Yogyakarta D.I.","Jl. Wates Km 2 Jl. KH Ahmad Dahlan Jl. Tata Bumi Jl. Murai VI No.169, Cobongan, Ngestiharjo, Kasihan, Bantul, Daerah Istimewa Yogyakarta  Dekat: Wirobrajan, Kadipiro, RSKIA Kahyangan, Malioboro, Nol Kilometer, Alun-alun Utara, Pasar Kuncen",https://www.olx.co.id/item/rumah-dijual-dalam-kota-jogja-7-menit-malioboro-nol-km-shm-dan-imb-iid-867214063
"JUAL CEPAT BU KostB Aru 26kt+RU Caf space jl kaliurang km 13,5 UII",Rp 2.850.000.000,Rumah,209,600,10,10,2,SHM - Sertifikat Hak Milik,"Depok, Sleman Kab., Yogyakarta D.I.",Fast Respon WA : 0813-9127-8889 / 0823-2337-4139,https://www.olx.co.id/item/jual-cepat-bu-kostb-aru-26ktru-cafe-space-jl-kaliurang-km-135-uii-iid-867213802
"TURUN 3,5M jd 2,8M Rumah Induk+14kt Kost Exclusive bangnanBAru jl kali",Rp 2.800.000.000,Rumah,416,600,10,10,2,SHM - Sertifikat Hak Milik,"Depok, Sleman Kab., Yogyakarta D.I.",Fast Respon WA : 0813-9127-8889 / 0823-2337-4139,https://www.olx.co.id/item/turun-35m-jd-28m-rumah-induk14kt-kost-exclusive-bangnanbaru-jl-kali-iid-867213673
Jual rumah dua lantai dalam Perumahan dekat Transmart dimaguwoharjo,Rp 2.750.000.000,Rumah,156,135,4,4,2,HGB - Hak Guna Bangun,"Depok, Sleman Kab., Yogyakarta D.I.",Jl.KH Muhdi Maguwoharjo dalam ringroad,https://www.olx.co.id/item/dijual-rumah-baru-mewah-dalam-perumahan-exclusive-didaerah-maguwoharjo-iid-867213603
"Rumah Mewah Cantik 2lt Perum dkt UMY,Gamping",Rp 2.250.000.000,Rumah,156,130,4,3,2,SHM - Sertifikat Hak Milik,"Depok, Sleman Kab., Yogyakarta D.I.",Fast Respon WA : 0813-9127-8889 / 0823-2337-4139,https://www.olx.co.id/item/rumah-mewah-cantik-2lt-perum-dkt-umygamping-iid-867213491
"Rumah Minimalis Strategis design Mewah Utara UGM jl Damai,jl Dayu",Rp 2.500.000.000,Rumah,143,180,5,4,2,SHM - Sertifikat Hak Milik,"Depok, Sleman Kab., Yogyakarta D.I.",Fast Respon WA : 0813-9127-8889 / 0823-2337-4139,https://www.olx.co.id/item/rumah-minimalis-strategis-design-mewah-utara-ugm-jl-damaijl-dayu-iid-867213357
"Rumah Istimewa dlm Perum dkt Balaikota,APMD",Rp 2.850.000.000,Rumah,240,260,6,4,2,SHM - Sertifikat Hak Milik,"Depok, Sleman Kab., Yogyakarta D.I.",Fast Respon WA : 0813-9127-8889 / 0823-2337-4139,https://www.olx.co.id/item/rumah-istimewa-dlm-perum-dkt-balaikotaapmd-iid-867213240
"Kost Exclusive Japanese Style dkt UPN,Seturan dlm Ringroad",Rp 2.450.000.000,Rumah,123,200,8,7,2,SHM - Sertifikat Hak Milik,"Depok, Sleman Kab., Yogyakarta D.I.",Fast Respon WA : 0813-9127-8889 / 0823-2337-4139,https://www.olx.co.id/item/kost-exclusive-japanese-style-dkt-upnseturan-dlm-ringroad-iid-867213203
Rumah Induk+Kost Exclusive dkt UMY dlm Perum,Rp 2.500.000.000,Rumah,137,200,9,9,2,SHM - Sertifikat Hak Milik,"Depok, Sleman Kab., Yogyakarta D.I.",Fast Respon WA : 0813-9127-8889 / 0823-2337-4139,https://www.olx.co.id/item/rumah-indukkost-exclusive-dkt-umy-dlm-perum-iid-867213086
"Kost Exclusive BAru 12kt 12km Jl Aspal Lebar Condongcatur dkt UPN,Hart",Rp 2.100.000.000,Rumah,128,256,10,10,2,SHM - Sertifikat Hak Milik,"Depok, Sleman Kab., Yogyakarta D.I.",Fast Respon WA : 0813-9127-8889 / 0823-2337-4139,https://www.olx.co.id/item/kost-exclusive-baru-12kt-12km-jl-aspal-lebar-condongcatur-dkt-upnhart-iid-867212967
Dijual Cepat Rumah Induk+Homestay/Kost dkt UGM jl kaliurang km 6,Rp 2.500.000.000,Rumah,241,219,10,10,2,SHM - Sertifikat Hak Milik,"Depok, Sleman Kab., Yogyakarta D.I.",Fast Respon WA : 0813-9127-8889 / 0823-2337-4139,https://www.olx.co.id/item/dijual-cepat-rumah-indukhomestaykost-dkt-ugm-jl-kaliurang-km-6-iid-867212826
Rumah sangat nyaman lingkungan sejuk dan asri cebongan,Rp 740.000.000,Rumah,100,70,3,2,1,SHM - Sertifikat Hak Milik,"Depok, Sleman Kab., Yogyakarta D.I.",Mlati sleman,https://www.olx.co.id/item/rumah-baru-siap-huni-utara-pasar-cebongan-iid-867212798
Kost 16kt 16 km Semi Exclusive Maguwo dlm Ringroad dkt Sheraton,Rp 2.300.000.000,Rumah,180,330,10,10,2,SHM - Sertifikat Hak Milik,"Depok, Sleman Kab., Yogyakarta D.I.",Fast Respon WA : 0813-9127-8889 / 0823-2337-4139,https://www.olx.co.id/item/kost-16kt-16-km-semi-exclusive-maguwo-dlm-ringroad-dkt-sheraton-iid-867212684
Hunian R E a d y - Syap Pake - Jakal Km 11,Rp 175.000.025,Rumah,43,40,2,1,1,HGB - Hak Guna Bangun,"Pakualaman, Yogyakarta Kota, Yogyakarta D.I.","Jln kaliurang km sebelas, Ngaglik slm yk",https://www.olx.co.id/item/hunian-harga-terjangkau-fasilitas-lengkap-jakal-km-11-iid-859329154
Rumah Induk Apartment 1 BR style + 5 Kost Exclusive pinggir jl Lebar d,Rp 3.000.000.000,Rumah,125,180,10,10,2,SHM - Sertifikat Hak Milik,"Depok, Sleman Kab., Yogyakarta D.I.",Fast Respon WA : 0813-9127-8889 / 0823-2337-4139,https://www.olx.co.id/item/rumah-induk-apartment-1-br-style-5-kost-exclusive-pinggir-jl-lebar-d-iid-867212535
Rumah Cantik 2lt Strategis dlm Perum jl kaliurang km 9 utara UGM,Rp 1.450.000.000,Rumah,100,150,4,3,2,SHM - Sertifikat Hak Milik,"Depok, Sleman Kab., Yogyakarta D.I.",Fast Respon WA : 0813-9127-8889 / 0823-2337-4139,https://www.olx.co.id/item/rumah-cantik-2lt-strategis-dlm-perum-jl-kaliurang-km-9-utara-ugm-iid-867212468
"Rumah Cantik 2lt Perum Tamantirta kasihan,Bantul dkt UMY",Rp 1.300.000.000,Rumah,108,168,4,3,2,SHM - Sertifikat Hak Milik,"Depok, Sleman Kab., Yogyakarta D.I.",Fast Respon WA : 0813-9127-8889 / 0823-2337-4139,https://www.olx.co.id/item/rumah-cantik-2lt-perum-tamantirta-kasihanbantul-dkt-umy-iid-867212318
Banting harga rumah 2 lantai furnish dlm ringroad di monjali,Rp 2.100.000.000,Rumah,227,270,5,5,2,SHM - Sertifikat Hak Milik,"Umbulharjo, Yogyakarta Kota, Yogyakarta D.I.","Jalan Monjali , Sleman",https://www.olx.co.id/item/banting-harga-rumah-2-lantai-furnish-dlm-ringroad-di-monjali-dekat-ugm-iid-859911033
Rumah Baru Furnish Dlm Cluster Eklusif Barat wirobrajan,Rp 1.615.000.000,Rumah,120,110,4,3,2,SHM - Sertifikat Hak Milik,"Wirobrajan, Yogyakarta Kota, Yogyakarta D.I.","Wirobrajan , jln wates km 3",https://www.olx.co.id/item/rumah-baru-full-furnish-dlm-cluster-dekat-wirobrajan-iid-859924335
Rumah Mewah di Condong Catur Dekat JIH dan Hartono Mall,Rp 1.500.000.000,Rumah,129,180,4,3,SHM - Sertifikat Hak Milik,SHM - Sertifikat Hak Milik,"Depok, Sleman Kab., Yogyakarta D.I.",Sleman,https://www.olx.co.id/item/rumah-full-furnish-siap-huni-dekat-jih-condong-catur-iid-866476944
Rumah Cantik 2lt Perum Nitikan Tengah Kota Jogja,Rp 1.600.000.000,Rumah,128,95,3,3,2,SHM - Sertifikat Hak Milik,"Depok, Sleman Kab., Yogyakarta D.I.",Fast Respon WA : 0813-9127-8889 / 0823-2337-4139,https://www.olx.co.id/item/rumah-cantik-2lt-perum-nitikan-tengah-kota-jogja-iid-867212181
"Rumah Dalam Perum Siap Huni Area Banguntapan, Kotagede, Jogja",Rp 650.000.000,Rumah,83,83,3,2,Jalan raya pleret,,"Umbulharjo, Yogyakarta Kota, Yogyakarta D.I.",Jalan raya pleret,https://www.olx.co.id/item/rumah-murah-hook-dlm-perum-elit-pondok-permai-banguntapan-iid-866493080
