title,price,land,building,bed,bath,floor,certificate,location
"ASET BTN YOGYA, PERUMAHAN MATANG DI WONOSARI, GUNUNG KIDUL, DIY",154500000,36,70,2,1,1,HGB - Hak Guna Bangun,"Wonosari, Gunung Kidul Kab., Yogyakarta D.I."
"Rumah Jogja Playen Wonosari Gunung Kidul 2 Lantai, dekat RS PKU, RSUD",499000000,72,60,3,2,2,HGB - Hak Guna Bangun,"Wonosari, Gunung Kidul Kab., Yogyakarta D.I."
"Rumah Playen dalam Perumahan Gunung Kidul, Jogja, Wonosari",155000000,60,36,2,1,2,HGB - Hak Guna Bangun,"Wonosari, Gunung Kidul Kab., Yogyakarta D.I."
"PROMO CASHBACK 3 UNIT Perumahan Baru Playen, Wonosari, Gunung Kidul",155000000,76,36,2,1,1,SHM - Sertifikat Hak Milik,"Wonosari, Gunung Kidul Kab., Yogyakarta D.I."
"rumah minimais , kasihan bantul",480000000,93,45,2,1,1,SHM - Sertifikat Hak Milik,"Wonosari, Gunung Kidul Kab., Yogyakarta D.I."
Dijual cepat rumah,360000000,479,77,3,1,1,SHM - Sertifikat Hak Milik,"Wonosari, Gunung Kidul Kab., Yogyakarta D.I."
"Kawasan Perumahan Baru Playen dekat RS PKU Wonosari, Gunung Kidul",449000000,72,60,3,2,2,HGB - Hak Guna Bangun,"Wonosari, Gunung Kidul Kab., Yogyakarta D.I."
"PROMO!! Rumah 2 Lantai dalam Perumahan dekat SMP Playen, Pasar, BKM",155000000,60,36,2,1,2,HGB - Hak Guna Bangun,"Wonosari, Gunung Kidul Kab., Yogyakarta D.I."
"Perumahan dengan Security 24 Jam di Playen, Wonosari, Gunung Kidul, Yk",449000000,72,60,3,2,2,HGB - Hak Guna Bangun,"Wonosari, Gunung Kidul Kab., Yogyakarta D.I."
"Type 36/60 2 Lantai dekat Kota Wonosari, Playen, Gunung Kidul, Jogja",130000000,60,36,2,1,2,HGB - Hak Guna Bangun,"Wonosari, Gunung Kidul Kab., Yogyakarta D.I."
RUMAH MURAH TANAH 216m DI WONOSARI KOTA,415000000,216,60,3,1,1,SHM - Sertifikat Hak Milik,"Wonosari, Gunung Kidul Kab., Yogyakarta D.I."
"Rumah Jogja Playen, gunung Kidul, dekat BKM Waterboom, SMP Playen",499000000,72,60,3,2,2,HGB - Hak Guna Bangun,"Wonosari, Gunung Kidul Kab., Yogyakarta D.I."
"Rumah 2 Lantai dalam Perumahan One Gate System, Jl. Manthous, Masjid",155000000,58,36,2,1,2,HGB - Hak Guna Bangun,"Wonosari, Gunung Kidul Kab., Yogyakarta D.I."
"2 Lantai dalam Perumahan (Bukan Subsidi). dekat Kota Wonosari, RS PKU",155000000,60,36,2,1,2,SHM - Sertifikat Hak Milik,"Wonosari, Gunung Kidul Kab., Yogyakarta D.I."
RUMAH TANPA UANG MUKA DP 0% DEKAT HOTEL SANTIKA WONOSARI,250000000,99,45,2,1,1,SHM - Sertifikat Hak Milik,"Wonosari, Gunung Kidul Kab., Yogyakarta D.I."
RUMAH TERMURAH DI WONOSARI DEKAT HOTEL SANTIKA,275000000,102,45,2,1,1,SHM - Sertifikat Hak Milik,"Wonosari, Gunung Kidul Kab., Yogyakarta D.I."
"2 Lantai dalam Perumahan (Bukan Subsidi). dekat Kota Wonosari, RS PKU",155000000,72,36,2,1,1,SHM - Sertifikat Hak Milik,"Wonosari, Gunung Kidul Kab., Yogyakarta D.I."
Dijual Rumah Area Yogyakarta Sleman Jalan Wonosari,950000000,120,85,3,2,1,SHM - Sertifikat Hak Milik,"Wonosari, Gunung Kidul Kab., Yogyakarta D.I."
JUAL RUMAH CEPAT MURAH,130990000,100,33,2,1,1,SHM - Sertifikat Hak Milik,"Wonosari, Gunung Kidul Kab., Yogyakarta D.I."
RUMAH TANPA UANG MUKA DP 0% DEKAT HOTEL SANTIKA WONOSARI,250000000,91,50,2,1,1,SHM - Sertifikat Hak Milik,"Wonosari, Gunung Kidul Kab., Yogyakarta D.I."
RUMAH PALING MURAH TANPA DP DI WONOSARI,200000000,60,40,2,1,1,SHM - Sertifikat Hak Milik,"Wonosari, Gunung Kidul Kab., Yogyakarta D.I."
RUMAH SUBSIDI DP 3JT CICILAN 900RBAN DI WONOSARI,150500000,60,32,2,1,1,SHM - Sertifikat Hak Milik,"Wonosari, Gunung Kidul Kab., Yogyakarta D.I."
Rumah baru grezz siap huni di gunung kidul,275000000,92,50,2,1,1,SHM - Sertifikat Hak Milik,"Wonosari, Gunung Kidul Kab., Yogyakarta D.I."
RUMAH MURAH SIAP HUNI DI WONOSARI,380000000,72,36,2,1,1,SHM - Sertifikat Hak Milik,"Wonosari, Gunung Kidul Kab., Yogyakarta D.I."
RUMAH CANTIK DP 0% PALING LARIS DI WONOSARI,250000000,84,45,2,1,1,SHM - Sertifikat Hak Milik,"Wonosari, Gunung Kidul Kab., Yogyakarta D.I."
RUMAH SIAP HUNI CANTIK MURAH DI WONOSARI,370000000,120,55,3,2,2,HGB - Hak Guna Bangun,"Wonosari, Gunung Kidul Kab., Yogyakarta D.I."
Rumah Murah kwalitas ok sleman yogya,800000000,152,120,3,1,1,SHM - Sertifikat Hak Milik,"Wonosari, Gunung Kidul Kab., Yogyakarta D.I."
RUMAH SIAP HUNI CANTIK MURAH DI WONOSARI,370000000,80,52,3,1,2,SHM - Sertifikat Hak Milik,"Wonosari, Gunung Kidul Kab., Yogyakarta D.I."
Rumah tempat tinggal dijual tinggal masuk,650000000,6022,384,5,4,2,SHM - Sertifikat Hak Milik,"Wonosari, Gunung Kidul Kab., Yogyakarta D.I."
Rumah Siap Huni di Wonosari dekat Hotel Santika SISA 1 UNIT,360000000,84,45,2,1,1,SHM - Sertifikat Hak Milik,"Wonosari, Gunung Kidul Kab., Yogyakarta D.I."
Perumahan Griya Logandeng Playen,200000000,72,36,2,1,1,SHM - Sertifikat Hak Milik,"Wonosari, Gunung Kidul Kab., Yogyakarta D.I."
Jual Rumah di Kasihan dekat Ringroad Selatan,476000000,93,45,2,1,0,SHM - Sertifikat Hak Milik,"Wonosari, Gunung Kidul Kab., Yogyakarta D.I."
Perumahan murah. Type 36/72,150000000,5412,2432,3,1,0,SHM - Sertifikat Hak Milik,"Wonosari, Gunung Kidul Kab., Yogyakarta D.I."
"Rumah Jogja Playen Wonosari Gunung Kidul 2 Lantai, dekat RS PKU, RSUD",499000000,73,60,3,2,2,HGB - Hak Guna Bangun,"Wonosari, Gunung Kidul Kab., Yogyakarta D.I."
Rumah murah dan strategis di logandeng dekat kota wonosari gunungkidul,155000000,60,36,2,1,2,HGB - Hak Guna Bangun,"Wonosari, Gunung Kidul Kab., Yogyakarta D.I."
Rumah MURAH CUCI GUDANG,90000000,100,30,1,1,1,SHM - Sertifikat Hak Milik,"Wonosari, Gunung Kidul Kab., Yogyakarta D.I."
"Rumah dekat Jl Manthous, Playen, Wonosari, Yogya, BKM Waterboom, SPBU",499000000,73,60,3,2,2,HGB - Hak Guna Bangun,"Wonosari, Gunung Kidul Kab., Yogyakarta D.I."
Apt. Mataram City Yudhistira Lt. 18 View Kota Investasi,770000569,34,34,1,1,18,SHM - Sertifikat Hak Milik,"Wonosari, Gunung Kidul Kab., Yogyakarta D.I."
RUMAH SUBSIDI TERLARIS PALING MURAH DI WONOSARI,150500000,104,36,2,1,1,SHM - Sertifikat Hak Milik,"Wonosari, Gunung Kidul Kab., Yogyakarta D.I."
"Kawasan Baru Wonosari Jogja, Perumahan Murah 2 Lantai dekat SMP Playen",130000000,60,36,2,1,2,HGB - Hak Guna Bangun,"Wonosari, Gunung Kidul Kab., Yogyakarta D.I."
RUMAH SIAP HUNI TERLARIS DEKAT HOTEL SANTIKA WONOSARI,380000000,84,45,2,1,1,SHM - Sertifikat Hak Milik,"Wonosari, Gunung Kidul Kab., Yogyakarta D.I."
RUMAH MURAH SIAP HUNI DI WONOSARI,380000000,216,60,3,1,1,SHM - Sertifikat Hak Milik,"Wonosari, Gunung Kidul Kab., Yogyakarta D.I."
"Rumah Jogja Playen, gunung Kidul, dekat BKM Waterboom, SMP Playen",499000000,70,57,3,2,2,HGB - Hak Guna Bangun,"Wonosari, Gunung Kidul Kab., Yogyakarta D.I."
"Rumah Murah 2 Lantai Playen Wonosari Jogja dekat RSUD, PKU, SMP, BKM",155000000,60,36,2,1,0,HGB - Hak Guna Bangun,"Wonosari, Gunung Kidul Kab., Yogyakarta D.I."
RUMAH SUBSIDI TERLARIS CICILAN 900RBAN DI WONOSARI,150500000,60,32,2,1,1,SHM - Sertifikat Hak Milik,"Wonosari, Gunung Kidul Kab., Yogyakarta D.I."
"DISKON s/d TGL 15 MEI, hanya 449 juta sudah mendapatkan Rumah 2 Lantai",449000000,73,60,3,2,2,HGB - Hak Guna Bangun,"Wonosari, Gunung Kidul Kab., Yogyakarta D.I."
"MEWAH MURAH! 2 Lantai dekat RSUD Wonosari, PKU, Kota. SMP Playen",499000000,73,60,3,2,2,HGB - Hak Guna Bangun,"Wonosari, Gunung Kidul Kab., Yogyakarta D.I."
rumah siap huni murah semanu gk yogya,175000000,70,210,3,1,60,SHM - Sertifikat Hak Milik,"Wonosari, Gunung Kidul Kab., Yogyakarta D.I."
"Perum Playen dekat Jalan Manthous, dekat Wonosari Kota, RSUD",499000000,73,60,3,2,2,HGB - Hak Guna Bangun,"Wonosari, Gunung Kidul Kab., Yogyakarta D.I."
"Rumah 135jt, siap KPR di Bank manapun. Lokasi Terbaik dekat UNY",135000384,60,30,2,1,1,SHM - Sertifikat Hak Milik,"Wonosari, Gunung Kidul Kab., Yogyakarta D.I."
RUMAH SIAP HUNI CANTIK MURAH DI WONOSARI,370000000,84,45,2,1,1,SHM - Sertifikat Hak Milik,"Wonosari, Gunung Kidul Kab., Yogyakarta D.I."
"499 JT Rumah 2 Lantai, 3 Kamar Tidur, 2 Kamar mandi, Playen, Wonosari",499000000,73,68,3,2,2,HGB - Hak Guna Bangun,"Wonosari, Gunung Kidul Kab., Yogyakarta D.I."
Jual Hunian Minimalis Di Wonosari Harga Subsidi Kualitas Premium,135000087,60,30,2,1,0,SHM - Sertifikat Hak Milik,"Wonosari, Gunung Kidul Kab., Yogyakarta D.I."
RUMAH SUBSIDI SIAP HUNI DP 3JT DI WONOSARI,150500000,60,30,2,1,1,SHM - Sertifikat Hak Milik,"Wonosari, Gunung Kidul Kab., Yogyakarta D.I."
RUMAH SUBSIDI TERLARIS PALING MURAH DI WONOSARI,150500000,60,32,2,1,1,SHM - Sertifikat Hak Milik,"Wonosari, Gunung Kidul Kab., Yogyakarta D.I."
"Rumah 2 lantai dekat Kota Wonosari, Gunung Kidul, Gerbang Mangku Aspal",499000000,72,60,3,2,1,HGB - Hak Guna Bangun,"Wonosari, Gunung Kidul Kab., Yogyakarta D.I."
"Kawasan Baru Wonosari Jogja, Perumahan Murah 2 Lantai dekat SMP Playen",130000000,59,36,2,1,2,HGB - Hak Guna Bangun,"Wonosari, Gunung Kidul Kab., Yogyakarta D.I."
RUMAH SUBSIDI MURAH KUALITAS PREMIUM DI MARISON REGENCY WONOSARI YOGYA,150500000,170,100,2,1,1,SHM - Sertifikat Hak Milik,"Wonosari, Gunung Kidul Kab., Yogyakarta D.I."
499 JUTA Rumah Jl Manthous 2 Lantai 3 Kamar Tidur 2 Kamar Mandi Playen,499000000,73,60,3,2,2,HGB - Hak Guna Bangun,"Wonosari, Gunung Kidul Kab., Yogyakarta D.I."
"Rumah dalam Perumahan One Gate, Security, Masjid, dekat Pasar Playen",130000000,60,36,2,1,2,HGB - Hak Guna Bangun,"Wonosari, Gunung Kidul Kab., Yogyakarta D.I."
RUMAH PALING MURAH DI KOTA WONOSARI DP 0%,200000000,60,40,2,1,1,SHM - Sertifikat Hak Milik,"Wonosari, Gunung Kidul Kab., Yogyakarta D.I."
RUMAH MURAH TANAH LUAS DEKAT RSUD WONOSARI DP 0%,415000000,216,60,3,1,1,SHM - Sertifikat Hak Milik,"Wonosari, Gunung Kidul Kab., Yogyakarta D.I."
Rumah Halaman Luas dekat Pusat Kota Wonosari,750000000,541,200,3,2,1,SHM - Sertifikat Hak Milik,"Wonosari, Gunung Kidul Kab., Yogyakarta D.I."
Rumah Modern Termurah di Wonosari Bisa KPR,226000000,90,50,2,1,1,SHM - Sertifikat Hak Milik,"Wonosari, Gunung Kidul Kab., Yogyakarta D.I."
"Rumah Pesan Bangun, Hanya 135jt, ke Pasar Wonosari cukup 7km",135000380,60,30,2,1,1,SHM - Sertifikat Hak Milik,"Wonosari, Gunung Kidul Kab., Yogyakarta D.I."
"ASET BTN YOGYA, PERUMAHAN MATANG DI WONOSARI, GUNUNG KIDUL, DIY",168000000,77,35,2,1,0,HGB - Hak Guna Bangun,"Wonosari, Gunung Kidul Kab., Yogyakarta D.I."
Rumah 2 lantai bangunan baru,1100000000,385,385,4,3,1,SHM - Sertifikat Hak Milik,"Wonosari, Gunung Kidul Kab., Yogyakarta D.I."
Rumah Minimalis Siap Huni Dekat Hotel Santika,360000000,195,65,3,2,1,SHM - Sertifikat Hak Milik,"Wonosari, Gunung Kidul Kab., Yogyakarta D.I."
Rumah 155 JT 2 Lantai dekat Gedung Siyono type 36/60 Jl Manthous,155000000,60,36,2,1,2,HGB - Hak Guna Bangun,"Wonosari, Gunung Kidul Kab., Yogyakarta D.I."
"Rumah Murah 2 Lantai Playen Wonosari Jogja dekat RSUD, PKU, SMP, BKM",155000000,58,36,2,1,2,HGB - Hak Guna Bangun,"Wonosari, Gunung Kidul Kab., Yogyakarta D.I."
"RUMAH TINGGAL DI JL KARANGMOJO KM 3, GUNUNGKIDUL, YOGYAKARTA",979000000,336,336,2,2,2,SHM - Sertifikat Hak Milik,"Wonosari, Gunung Kidul Kab., Yogyakarta D.I."
Kode RSH806 #Rumah Siap Huni Di Karang Mojo Gunungkidul Yogyakarta,450000000,500,350,2,2,1,SHM - Sertifikat Hak Milik,"Karangmojo, Gunung Kidul Kab., Yogyakarta D.I."
"NEW RESIDENCE BAHAGIA Jogja dekat Kota Wonosari, Rumah dalam Perumahan",449000000,73,58,3,2,2,HGB - Hak Guna Bangun,"Playen, Gunung Kidul Kab., Yogyakarta D.I."
Manfaatkan Mudikmu dengan Survey Lokasi Perumahan Baru Yogya Wonosari,155000000,60,34,2,1,2,HGB - Hak Guna Bangun,"Playen, Gunung Kidul Kab., Yogyakarta D.I."
RUMAH MURAH DP 0% DI DEKAT ALUN ALUN GUNUNG KIDUL HARGA 200JTAN,209999999,72,36,2,1,0,SHM - Sertifikat Hak Milik,"Playen, Gunung Kidul Kab., Yogyakarta D.I."
"Rumah Jogja, Gunung Kidul, Playen, dekat calon Kampus UGM, dekat RSUD",155000000,58,36,2,1,2,HGB - Hak Guna Bangun,"Playen, Gunung Kidul Kab., Yogyakarta D.I."
Apartemen Mataram City Yudhistira Lt. Atas View Merapi Investasi,770000127,370,170,4,1,1,SHM - Sertifikat Hak Milik,"Paliyan, Gunung Kidul Kab., Yogyakarta D.I."
RUMAH MURAH TANAH LUAS DP 0% DI PLAYEN,270000000,84,45,2,1,1,SHM - Sertifikat Hak Milik,"Playen, Gunung Kidul Kab., Yogyakarta D.I."
"Perumahan dekat SMA SMK Wonosari, SMP Playen, Polres Gunung Kidul",499000000,71,60,3,2,2,HGB - Hak Guna Bangun,"Playen, Gunung Kidul Kab., Yogyakarta D.I."
TERMURAH DI JOGJA! RUMAH CANTIK MINIMALIS DEKAT KOTA,227000000,69,41,2,1,1,SHM - Sertifikat Hak Milik,"Playen, Gunung Kidul Kab., Yogyakarta D.I."
"RUMAH PESAN BANGUN 2 LANTAI DEKAT JALAN MANTHOUS, PLAYEN, WONOSARI",499000000,73,59,3,2,2,HGB - Hak Guna Bangun,"Playen, Gunung Kidul Kab., Yogyakarta D.I."
Perumahan Baru dekat Kota Wonosari Gunung Kidul,155000000,60,35,2,1,2,HGB - Hak Guna Bangun,"Playen, Gunung Kidul Kab., Yogyakarta D.I."
Jual Hunian Minimalis Di Gunung Kidul 200jtan Siap KPR!!!,226000087,90,50,2,1,1,SHM - Sertifikat Hak Milik,"Playen, Gunung Kidul Kab., Yogyakarta D.I."
TERBARU RUMAH MURAH DI WONOSARI HANYA 200JTAN,225999999,74,54,2,1,1,SHM - Sertifikat Hak Milik,"Playen, Gunung Kidul Kab., Yogyakarta D.I."
Rumah siap huni di krangmojo,300000000,71,50,2,1,1,SHM - Sertifikat Hak Milik,"Karangmojo, Gunung Kidul Kab., Yogyakarta D.I."
rumah murah DP 0 % di kota Wonosari,255000000,105,50,2,1,1,SHM - Sertifikat Hak Milik,"Playen, Gunung Kidul Kab., Yogyakarta D.I."
"RUMAH PESAN BANGUN 2 LANTAI DEKAT JALAN MANTHOUS, PLAYEN, WONOSARI",499000000,120,60,3,2,2,HGB - Hak Guna Bangun,"Playen, Gunung Kidul Kab., Yogyakarta D.I."
RUMAH PALING MURAH DI KARANGMOJO,160000000,77,36,2,1,1,SHM - Sertifikat Hak Milik,"Karangmojo, Gunung Kidul Kab., Yogyakarta D.I."
"Investasi Rumah di Gunung Kidul, dekat RSUD Wonosari, PKU, Waterboom",499000000,72,60,3,2,1,HGB - Hak Guna Bangun,"Playen, Gunung Kidul Kab., Yogyakarta D.I."
dijual tanah bonus rumah,1600000000,1050,400,5,2,1,SHM - Sertifikat Hak Milik,"Semanu, Gunung Kidul Kab., Yogyakarta D.I."
"Jual Rumah Minimalis Modern Hanya 200jtan Di Gunung Kidul, Siap KPR!!!",226000077,90,50,2,1,1,SHM - Sertifikat Hak Milik,"Playen, Gunung Kidul Kab., Yogyakarta D.I."
RUMAH PALING MURAH DI GUNUNG KIDUL DESIGN MODEREN HARGA 200JTAN,226000000,60,36,2,1,1,SHM - Sertifikat Hak Milik,"Playen, Gunung Kidul Kab., Yogyakarta D.I."
"Rumah Minimalis Wonosari, Jalan Manthous, dalam Perumahan, ada Masjid",499000000,72,60,3,2,2,HGB - Hak Guna Bangun,"Playen, Gunung Kidul Kab., Yogyakarta D.I."
RUMAH CANTIK HARGA MURAH DEKAT TAHURA BUNDER JOGJA,269999000,92,50,2,1,1,SHM - Sertifikat Hak Milik,"Playen, Gunung Kidul Kab., Yogyakarta D.I."
"beli rumah dapat emas, untuk istri",255000000,352,80,3,1,1,SHM - Sertifikat Hak Milik,"Semanu, Gunung Kidul Kab., Yogyakarta D.I."
RUMAH TERMURAH DI WONOSARI DP 0%,136000000,60,36,2,1,1,SHM - Sertifikat Hak Milik,"Playen, Gunung Kidul Kab., Yogyakarta D.I."
TERMURAH DI JOGJA! RUMAH CANTIK MINIMALIS DEKAT KOTA,227000000,72,36,2,1,1,SHM - Sertifikat Hak Milik,"Playen, Gunung Kidul Kab., Yogyakarta D.I."
Apartemen Mataram City Yudhistira Lt. Tinggi View Kota Murah,770000342,800,250,4,2,1,SHM - Sertifikat Hak Milik,"Playen, Gunung Kidul Kab., Yogyakarta D.I."
Hunian Nyaman dekat Bunderan Siyono hanya 200jtan ? Ada dong,226000304,90,50,2,1,1,SHM - Sertifikat Hak Milik,"Playen, Gunung Kidul Kab., Yogyakarta D.I."
Rumah dengan tnh luas 1050m jalan Semanu Wonosari,1600000000,1050,400,5,2,0,SHM - Sertifikat Hak Milik,"Semanu, Gunung Kidul Kab., Yogyakarta D.I."
OPSI Rumah Singgah / Investasi di Gunung Kidul dekat Kota Wonosari,499000000,72,60,3,2,2,HGB - Hak Guna Bangun,"Playen, Gunung Kidul Kab., Yogyakarta D.I."
RUMAH MINIMALIS DEKAT TAHURA BUNDER JOGJA,269999001,84,45,2,1,1,SHM - Sertifikat Hak Milik,"Playen, Gunung Kidul Kab., Yogyakarta D.I."
Rumh dan kolam ikan,1300000000,841,841,8,4,2,SHM - Sertifikat Hak Milik,"Karangmojo, Gunung Kidul Kab., Yogyakarta D.I."
rumah murah DP 0 % di kota Wonosari,255000000,72,36,2,1,1,SHM - Sertifikat Hak Milik,"Playen, Gunung Kidul Kab., Yogyakarta D.I."
"rumah murah luas , di tamantirto kasihan",389000000,93,45,2,1,1,SHM - Sertifikat Hak Milik,"Playen, Gunung Kidul Kab., Yogyakarta D.I."
RUMAH CANTIK DP 0% TEPI JALAN UTAMA PLAYEN,270000000,84,45,2,1,1,SHM - Sertifikat Hak Milik,"Playen, Gunung Kidul Kab., Yogyakarta D.I."
RUMAH MURAH DI GUNUNG KIDUL BISA CUSTOM SENDIRI..,274999999,80,50,2,1,1,SHM - Sertifikat Hak Milik,"Playen, Gunung Kidul Kab., Yogyakarta D.I."
Jual Hunian Minimalis Di Gunung Kidul Hanya 200jtan Legalitas SHM,226000085,90,50,2,1,1,SHM - Sertifikat Hak Milik,"Playen, Gunung Kidul Kab., Yogyakarta D.I."
Rumah hunian tembok kokoh istimewa,1300000000,2000,200,3,2,1,SHM - Sertifikat Hak Milik,"Karangmojo, Gunung Kidul Kab., Yogyakarta D.I."
"Bahagia Residence 2 Lantai, Security 24 Jam, Playen, Wonosari, Jogja",499000000,73,60,3,2,2,SHM - Sertifikat Hak Milik,"Playen, Gunung Kidul Kab., Yogyakarta D.I."
RUMAH PALING MURAH DI PLAYEN DP 0%,270000000,78,45,2,1,1,SHM - Sertifikat Hak Milik,"Playen, Gunung Kidul Kab., Yogyakarta D.I."
RUMAH PALING MURAH 136 JT DI PLAYEN DP 0%,136000000,60,36,2,1,1,SHM - Sertifikat Hak Milik,"Playen, Gunung Kidul Kab., Yogyakarta D.I."
Puri Bendungan Asri Karangmojo Gunungkidul Yogyakarta,145000000,86,36,2,1,1,SHM - Sertifikat Hak Milik,"Karangmojo, Gunung Kidul Kab., Yogyakarta D.I."
Apartemen Mataram City Yudhistira Lt. Tinggi View Merapi Investasi,770000975,293,155,5,2,2,SHM - Sertifikat Hak Milik,"Semanu, Gunung Kidul Kab., Yogyakarta D.I."
"New Cluster Bahagia Residence dekat Wonosari Kota, RSUD, PKU, SMP, SMK",499000000,72,60,3,2,2,HGB - Hak Guna Bangun,"Playen, Gunung Kidul Kab., Yogyakarta D.I."
"Rumah dalam Perumahan Baru Gunung Kidul, dekat Wonosari Kota, Playen",155000000,60,36,2,1,2,HGB - Hak Guna Bangun,"Playen, Gunung Kidul Kab., Yogyakarta D.I."
"Investasi Rumah di Gunung Kidul, dekat RSUD Wonosari, PKU, Waterboom",499000000,73,59,3,2,0,HGB - Hak Guna Bangun,"Playen, Gunung Kidul Kab., Yogyakarta D.I."
Rumah Minimalis Siap Huni Dekat Hotel Santika,360000000,1473,400,2,1,1,SHM - Sertifikat Hak Milik,"Playen, Gunung Kidul Kab., Yogyakarta D.I."
Apartemen Mataram City Yudhistira Lt. Tinggi View Kota Murah,770000342,641,500,3,2,0,SHM - Sertifikat Hak Milik,"Playen, Gunung Kidul Kab., Yogyakarta D.I."
Jual Rumah Murah Pinngir jalan BU cepet,408000000,72,32,2,1,1,SHM - Sertifikat Hak Milik,"Playen, Gunung Kidul Kab., Yogyakarta D.I."
RUMAH CANTIK HARGA MURAH DEKAT TAHURA BUNDER JOGJA,269999000,84,45,2,1,1,SHM - Sertifikat Hak Milik,"Playen, Gunung Kidul Kab., Yogyakarta D.I."
"Rumah 2 Lantai Jogja, Gunung Kidul, Playen dekat RS PKU,SMP, Waterboom",499000000,73,59,3,2,2,HGB - Hak Guna Bangun,"Playen, Gunung Kidul Kab., Yogyakarta D.I."
"Rumah Jogja, Gunung Kidul, Playen, dekat calon Kampus UGM, dekat RSUD",155000000,60,36,2,1,2,HGB - Hak Guna Bangun,"Playen, Gunung Kidul Kab., Yogyakarta D.I."
Ramadhan Sale ! RUMAH MURAH DI WONOSARI HANYA 200JTAN,225999999,91,50,2,1,1,SHM - Sertifikat Hak Milik,"Playen, Gunung Kidul Kab., Yogyakarta D.I."
DI JUAL RUMAH KONDISI SIAP PAKAI,900000000,34,34,1,1,18,SHM - Sertifikat Hak Milik,"Semanu, Gunung Kidul Kab., Yogyakarta D.I."
Rumah dijual asri nyaman,650000000,34,34,1,1,18,SHM - Sertifikat Hak Milik,"Playen, Gunung Kidul Kab., Yogyakarta D.I."
Bu rumah besar di jual murah,700000000,34,34,1,1,18,SHM - Sertifikat Hak Milik,"Paliyan, Gunung Kidul Kab., Yogyakarta D.I."
Jual rumah jawa timur status kontrak bank bri,750000000,34,34,1,1,18,SHM - Sertifikat Hak Milik,"Karangmojo, Gunung Kidul Kab., Yogyakarta D.I."
"Investasi Rumah di Gunung Kidul, dekat RSUD Wonosari, PKU, Waterboom",499000000,73,60,3,2,2,HGB - Hak Guna Bangun,"Playen, Gunung Kidul Kab., Yogyakarta D.I."
"Rumah dijual Jogja Gunung Kidul dekat RSUD Wonosari, SMP Playen",155000000,60,36,2,1,2,HGB - Hak Guna Bangun,"Playen, Gunung Kidul Kab., Yogyakarta D.I."
Manfaatkan Mudikmu dengan Survey Lokasi Perumahan Baru Yogya Wonosari,155000000,60,36,2,1,2,SHM - Sertifikat Hak Milik,"Playen, Gunung Kidul Kab., Yogyakarta D.I."
Apartemen Mataram City Yudhistira Lt. Atas View Kota Bs Dicicil,770000189,285,285,4,2,2,SHM - Sertifikat Hak Milik,"Karangmojo, Gunung Kidul Kab., Yogyakarta D.I."
RUMAH CANTIK DIJUAL DP 0% DI PLAYEN,270000000,84,45,2,1,1,SHM - Sertifikat Hak Milik,"Playen, Gunung Kidul Kab., Yogyakarta D.I."
Perumahan Baru dekat Kota Wonosari Gunung Kidul,155000000,60,36,2,1,2,HGB - Hak Guna Bangun,"Playen, Gunung Kidul Kab., Yogyakarta D.I."
RUMAH PALING MURAH DP 0% DI GUNUNG KIDUL,270000000,92,45,2,1,1,SHM - Sertifikat Hak Milik,"Playen, Gunung Kidul Kab., Yogyakarta D.I."
Perumahan Griya Logandeng Playen,200000000,72,36,2,1,1,SHM - Sertifikat Hak Milik,"Playen, Gunung Kidul Kab., Yogyakarta D.I."
TERMURAH DI JOGJA! RUMAH CANTIK MINIMALIS DEKAT KOTA,227000000,58,36,2,1,1,SHM - Sertifikat Hak Milik,"Playen, Gunung Kidul Kab., Yogyakarta D.I."
Manfaatkan Mudikmu dengan Survey Lokasi Perumahan Baru Yogya Wonosari,155000000,64,34,2,1,5,HGB - Hak Guna Bangun,"Playen, Gunung Kidul Kab., Yogyakarta D.I."
TERBARU RUMAH MURAH DI WONOSARI HANYA 200JTAN,225999999,91,50,2,1,1,SHM - Sertifikat Hak Milik,"Playen, Gunung Kidul Kab., Yogyakarta D.I."
RUMAH PALING MURAH DP 0% DI GUNUNG KIDUL,270000000,84,45,2,1,1,SHM - Sertifikat Hak Milik,"Playen, Gunung Kidul Kab., Yogyakarta D.I."
"Rumah 2 Lantai Perumahan Playen Baru, dekat Jalan Manthous, Wonosari",499000000,72,60,3,2,0,HGB - Hak Guna Bangun,"Playen, Gunung Kidul Kab., Yogyakarta D.I."
"Rumah 2 Lantai Playen, Wonosari, Yogyakarta, One Gate System, Masjid",155000000,60,34,2,1,0,HGB - Hak Guna Bangun,"Playen, Gunung Kidul Kab., Yogyakarta D.I."
RUMAH MURAH DP 0% DI DEKAT ALUN ALUN GUNUNG KIDUL HARGA 200JTAN,209999999,90,50,2,1,1,SHM - Sertifikat Hak Milik,"Playen, Gunung Kidul Kab., Yogyakarta D.I."
Rumah Kekinian di tengah kota gunungkidul,175000000,60,36,2,1,0,SHM - Sertifikat Hak Milik,"Playen, Gunung Kidul Kab., Yogyakarta D.I."
"Rumah 2 Lantai Jogja, Gunung Kidul, Playen dekat RS PKU,SMP, Waterboom",499000000,73,60,3,2,2,HGB - Hak Guna Bangun,"Playen, Gunung Kidul Kab., Yogyakarta D.I."
RUMAH MURAH TANAH LUAS DP 0% DI PLAYEN,270000000,92,50,2,1,1,SHM - Sertifikat Hak Milik,"Playen, Gunung Kidul Kab., Yogyakarta D.I."
"Rumah 2 Lantai Jogja, Gunung Kidul, Playen dekat RS PKU,SMP, Waterboom",499000000,71,60,3,2,2,HGB - Hak Guna Bangun,"Playen, Gunung Kidul Kab., Yogyakarta D.I."
Rumah Perumahan dekat Kota Wonosari Jogja dekat BKM Waterboom Playen,130000000,58,34,2,1,2,HGB - Hak Guna Bangun,"Playen, Gunung Kidul Kab., Yogyakarta D.I."
RUMAH PALING MURAH DI PLAYEN DP 0%,270000000,84,45,2,1,1,SHM - Sertifikat Hak Milik,"Playen, Gunung Kidul Kab., Yogyakarta D.I."
RUMAH PALING MURAH DI GUNUNG KIDUL DESIGN MODEREN HARGA 200JTAN,226000000,90,50,2,1,1,SHM - Sertifikat Hak Milik,"Playen, Gunung Kidul Kab., Yogyakarta D.I."
"NEW RESIDENCE BAHAGIA Jogja dekat Kota Wonosari, Rumah dalam Perumahan",449000000,72,60,3,2,2,HGB - Hak Guna Bangun,"Playen, Gunung Kidul Kab., Yogyakarta D.I."
"Rumah 2 Lantai Wonosari dalam Perumahan One Gate System, dekat Pasar",155000000,60,36,2,1,1,HGB - Hak Guna Bangun,"Playen, Gunung Kidul Kab., Yogyakarta D.I."
Rumah Siap Huni Dekat Pasar Potorono,470000000,60,85,3,1,2,SHM - Sertifikat Hak Milik,"Piyungan, Bantul Kab., Yogyakarta D.I."
Dijual rumah dalam komplek perumahan di seputaran banguntapan bantul,485000000,86,60,2,2,1,SHM - Sertifikat Hak Milik,"Piyungan, Bantul Kab., Yogyakarta D.I."
Rumah Minimalis Grand Intan Regency Strategis 3 Menit dr Giwangan,499000000,84,58,2,1,1,SHM - Sertifikat Hak Milik,"Pleret, Bantul Kab., Yogyakarta D.I."
SIAP HUNI JOGLO CANTIK DI LUASAN 375 m2 AREA PRAMBANAN KLATEN,1300000000,375,135,4,5,1,SHM - Sertifikat Hak Milik,"Prambanan, Sleman Kab., Yogyakarta D.I."
Jual Hunian Minimalis Di Prambanan Konsep Klasik Siap KPR!!!,470000000,157,57,2,1,1,SHM - Sertifikat Hak Milik,"Prambanan, Sleman Kab., Yogyakarta D.I."
piyungan rumah dijual,365000000,85,35,2,1,1,SHM - Sertifikat Hak Milik,"Piyungan, Bantul Kab., Yogyakarta D.I."
NUANSA HERITAGE PREMIUM HUNIAN LIMASAN 500 JUTAAN FULL BATA EKSPOSE,501500000,86,45,2,1,1,SHM - Sertifikat Hak Milik,"Prambanan, Sleman Kab., Yogyakarta D.I."
Kode RSH 250 # Rumah Cantik Siap Huni di Utara Pasar Pleret Bantul,400000000,89,89,2,2,2,SHM - Sertifikat Hak Milik,"Pleret, Bantul Kab., Yogyakarta D.I."
Rumah Minimalis Klaster di Timur Jogja,485000287,75,45,2,2,1,SHM - Sertifikat Hak Milik,"Prambanan, Sleman Kab., Yogyakarta D.I."
2 UNIT TERAKHIR !! RUMAH MURAH 200JTAN DI PRAMBANAN DEKAT EXIT TOL,289999999,76,36,2,1,1,SHM - Sertifikat Hak Milik,"Prambanan, Sleman Kab., Yogyakarta D.I."
Bagus &amp; Murah Rumah Desain Cantik Limasan 300 Juta di Utara Prambanan,300000000,110,36,2,1,1,SHM - Sertifikat Hak Milik,"Prambanan, Sleman Kab., Yogyakarta D.I."
Jual Hunian Minimalis Di Prambanan Konsep Klasik Siap KPR!!!,470000000,84,36,2,1,1,SHM - Sertifikat Hak Milik,"Prambanan, Sleman Kab., Yogyakarta D.I."
Miliki Hunian Konsep Heritage di Lingkungan Asri Timur Jogja 200 Jt-an,250000045,85,30,2,1,1,SHM - Sertifikat Hak Milik,"Prambanan, Sleman Kab., Yogyakarta D.I."
Rumah Classic Siap Huni di Cluster Prambanan Village III,485000000,84,36,2,1,1,SHM - Sertifikat Hak Milik,"Prambanan, Sleman Kab., Yogyakarta D.I."
Rumah Minimalis Piyungan Bantul,1800000000,588,200,5,3,1,SHM - Sertifikat Hak Milik,"Piyungan, Bantul Kab., Yogyakarta D.I."
Dekat  Situs Payak Jalan Wonosari km 12 Srimulyo Piyungan,649000000,158,90,3,2,1,SHM - Sertifikat Hak Milik,"Piyungan, Bantul Kab., Yogyakarta D.I."
Rumah Eksklusif 2 Lantai dekat Jalan Wonosari Jogja Dibawah 900 Juta,850000024,108,68,3,3,2,SHM - Sertifikat Hak Milik,"Piyungan, Bantul Kab., Yogyakarta D.I."
WOW Cuma 400 Jutaan Sudah Dapat Rumah Estetik di Piyungan Bantul,440000046,79,45,2,1,1,SHM - Sertifikat Hak Milik,"Piyungan, Bantul Kab., Yogyakarta D.I."
"DESIGN MINIMALIS CANTIK, RUMAH 215 JUTA DI PRAMBANAN",215000000,85,30,2,1,1,SHM - Sertifikat Hak Milik,"Prambanan, Sleman Kab., Yogyakarta D.I."
Cluster Dengan Desain Modern Strategis Dekat Pasar Giwangan,461879000,80,45,2,1,1,SHM - Sertifikat Hak Milik,"Pleret, Bantul Kab., Yogyakarta D.I."
Dijual cluster dengan skema bayar mudah,360000000,81,45,2,1,1,SHM - Sertifikat Hak Milik,"Pleret, Bantul Kab., Yogyakarta D.I."
ONE SYSTEM GATE PROSES BANGUN CASHBACK PULUHAN JUTA DEKAT RINGROAD,369999636,75,47,2,1,1,SHM - Sertifikat Hak Milik,"Pleret, Bantul Kab., Yogyakarta D.I."
