title,price,land,building,bed,bath,floor,certificate,location
Dijual Rumah Baru Menarik Bonus Furniture Dekat Kampus UII Terpadu,685000023,186,258,7,3,2,SHM - Sertifikat Hak Milik,"Ngaglik, Sleman Kab., Yogyakarta D.I."
Rumah Cantik dan Murah di Purwomartani dekat Pamela 7,600000000,104,80,3,2,1,HGB - Hak Guna Bangun,"Kalasan, Sleman Kab., Yogyakarta D.I."
Rumah Mewah Dalam Perumahan Palagan Asri,4250000000,245,280,5,4,2,SHM - Sertifikat Hak Milik,"Ngaglik, Sleman Kab., Yogyakarta D.I."
Jual Hunian Megah 2 Lantai Di Sleman Legalitas SHM Siap KPR,1500000055,150,160,3,4,2,SHM - Sertifikat Hak Milik,"Ngemplak, Sleman Kab., Yogyakarta D.I."
Rumah mewah full furnish view gunung merapi timur pasar gentan,1595000000,512,250,6,4,1,SHM - Sertifikat Hak Milik,"Ngaglik, Sleman Kab., Yogyakarta D.I."
RUMAH 2 LANTAI MEWAH MODERN STRATEGIS DEKAT JOGJA BAY SLEMAN YOGYA,2850000000,326,327,5,4,3,SHM - Sertifikat Hak Milik,"Ngemplak, Sleman Kab., Yogyakarta D.I."
"Dijual rumah di Berbah, strategis pinggir jalan utama",1600000000,306,200,5,5,1,SHM - Sertifikat Hak Milik,"Berbah, Sleman Kab., Yogyakarta D.I."
Rumah besar furnish area Palagan,3700000000,214,255,4,4,2,HGB - Hak Guna Bangun,"Mlati, Sleman Kab., Yogyakarta D.I."
"Dijual Gedung Ex Sekolah VVIP jl kaliurang km 13,5 dkt UII Lt 3356m2",20000000000,4500,1100,7,7,1,SHM - Sertifikat Hak Milik,"Ngaglik, Sleman Kab., Yogyakarta D.I."
RUMAH KOST DIJUAL DEKAT UGM,3100000000,206,240,4,3,2,SHM - Sertifikat Hak Milik,"Ngaglik, Sleman Kab., Yogyakarta D.I."
"Perumahan onegate Kaliurang Dekat UGM,UII,UNY,RSAUGM",788000000,150,45,2,1,1,SHM - Sertifikat Hak Milik,"Ngaglik, Sleman Kab., Yogyakarta D.I."
Rumah etnik mewah joglo kolam renang maguwoharjo view cantik,7500000000,1200,600,4,4,1,HGB - Hak Guna Bangun,"Depok, Sleman Kab., Yogyakarta D.I."
Rumah Cantik Elegan Siap Huni Dekat RIngin Purwomartani Kalasan,625000004,115,80,3,2,1,SHM - Sertifikat Hak Milik,"Kalasan, Sleman Kab., Yogyakarta D.I."
rumah guesthouse 8 kamar full furnished dekat sd Budi mulia jl tajem,1500000000,266,125,3,2,1,SHM - Sertifikat Hak Milik,"Ngemplak, Sleman Kab., Yogyakarta D.I."
"Rumah asri dengan tanah luas di Tajem, dekat jalan raya Selomartani",2500000000,765,250,5,3,1,SHM - Sertifikat Hak Milik,"Ngemplak, Sleman Kab., Yogyakarta D.I."
DIJUAL RUMAH NO.B7 PERUMAHAN TELAGA JATI ASRI,330000000,88,45,2,1,1,HGB - Hak Guna Bangun,"Wonosari, Gunung Kidul Kab., Yogyakarta D.I."
Rumah Dijual Perumahan Lempongsari dkt Hotel Hyatt Jl. Palagan &amp; UGM,2000000000,172,160,4,3,2,SHM - Sertifikat Hak Milik,"Ngaglik, Sleman Kab., Yogyakarta D.I."
"Dijual 1 Unit Rumah Siap Bangun di Godean, Type 45/101 Rp 525 juta",525000306,101,45,2,1,1,SHM - Sertifikat Hak Milik,"Godean, Sleman Kab., Yogyakarta D.I."
"Full Furnish, Rumah Siap Tempati Type 80/140 m2 Siap KPR Di Sleman",700000316,140,110,4,2,1,SHM - Sertifikat Hak Milik,"Kalasan, Sleman Kab., Yogyakarta D.I."
"Rumah Dijogja, Sleman Rumah dua Lantai, dekat Jl Gito Gati, SCH",1800000000,150,200,4,4,2,SHM - Sertifikat Hak Milik,"Sleman, Sleman Kab., Yogyakarta D.I."
Tanah Murah Sleman 118 m2 Standar Perumahan,117000000,76,76,1,1,1,SHM - Sertifikat Hak Milik,"Minggir, Sleman Kab., Yogyakarta D.I."
Jual Rumah Kavling Bisa KPR di Sidokarto Godean,450000011,70,45,2,1,1,SHM - Sertifikat Hak Milik,"Godean, Sleman Kab., Yogyakarta D.I."
Rumah Baru Jalan Kaliurang Dekat Uii,750000000,126,70,2,2,1,SHM - Sertifikat Hak Milik,"Ngaglik, Sleman Kab., Yogyakarta D.I."
Rumah Apik dekat Kampus UII Jalan Kaliurang,875000000,117,80,3,2,1,SHM - Sertifikat Hak Milik,"Ngaglik, Sleman Kab., Yogyakarta D.I."
Langka Luas Murah Jual Cepat Rumah dlm Perumahan Elite Green Hills,3100000000,271,150,3,3,2,SHM - Sertifikat Hak Milik,"Ngaglik, Sleman Kab., Yogyakarta D.I."
Rumah Cantik Siap Huni Di jl Imogiri barat km 8,460000000,85,45,2,1,1,SHM - Sertifikat Hak Milik,"Sewon, Bantul Kab., Yogyakarta D.I."
rumah siap huni jl Godean km 10 ke Utara dekat RS at turots,460000005,101,70,3,2,1,SHM - Sertifikat Hak Milik,"Seyegan, Sleman Kab., Yogyakarta D.I."
Rumah baru Sardonoharjo dekat kampus Uii,750000000,189,100,3,2,1,SHM - Sertifikat Hak Milik,"Ngaglik, Sleman Kab., Yogyakarta D.I."
"Rumah siap bangun 435 juta dekat polres bantul,  gose di ringinharjo",435000001,90,45,2,1,1,SHM - Sertifikat Hak Milik,"Bantul, Bantul Kab., Yogyakarta D.I."
"DIJUAL  MURAH SEGERA !!!
RUMAH SIAP HUNI 350 JUTA DI SLEMAN",350000000,110,40,2,1,1,SHM - Sertifikat Hak Milik,"Kalasan, Sleman Kab., Yogyakarta D.I."
Rumah 2 lantai full furnish dekat hotel hyatt,1700000000,136,110,3,2,2,SHM - Sertifikat Hak Milik,"Mlati, Sleman Kab., Yogyakarta D.I."
Riumah Model Paris di Perum Elite Merapi View Jl Kaliurang dekat UII B,2300000000,162,100,3,2,2,SHM - Sertifikat Hak Milik,"Ngaglik, Sleman Kab., Yogyakarta D.I."
"Rumah Idaman Area Jalan Damai, Harga Murah, Strategis",790008780,106,60,3,2,1,SHM - Sertifikat Hak Milik,"Ngaglik, Sleman Kab., Yogyakarta D.I."
Rumah Klasik Mewah Dengan Perabot Lengkap Dekat Pamella Tujuh Kalasan,2000000000,128,258,5,4,2,SHM - Sertifikat Hak Milik,"Kalasan, Sleman Kab., Yogyakarta D.I."
Rumah Murah Bisa KPR di Area Prambanan: Konsep Heritage,260009999,87,45,2,1,1,SHM - Sertifikat Hak Milik,"Sleman, Sleman Kab., Yogyakarta D.I."
Rumah Pinggir Jalan Magelang (Strategis Banget),1495000000,103,110,4,2,2,SHM - Sertifikat Hak Milik,"Mlati, Sleman Kab., Yogyakarta D.I."
"Rumah Dalam Perumahan Jl.Palagan Km.8 Dekat Hyatt,Monjali,UGM",775000000,91,60,2,1,1,SHM - Sertifikat Hak Milik,"Ngaglik, Sleman Kab., Yogyakarta D.I."
Rumah Dekat Jalan Imogiri Timur di Puton Jetis Siap Bangun,385000000,107,45,2,1,1,SHM - Sertifikat Hak Milik,"Jetis, Bantul Kab., Yogyakarta D.I."
"Dijual Rumah Sleman, Umbulmartani View Merapi Timur Kampus UII TERPADU",650000088,104,63,2,1,2,SHM - Sertifikat Hak Milik,"Ngemplak, Sleman Kab., Yogyakarta D.I."
Rumah Minimalis Jl Pendowoharjo Dalam Cluster,480000000,112,45,2,1,1,SHM - Sertifikat Hak Milik,"Tempel, Sleman Kab., Yogyakarta D.I."
Rumah Tropis di Laguna Spring Jalan Wonosari,2500000000,127,130,3,3,2,HGB - Hak Guna Bangun,"Banguntapan, Bantul Kab., Yogyakarta D.I."
Bu jual rumah baru tanah luas di manisrenggo view sawah,375000000,67,50,2,1,1,SHM - Sertifikat Hak Milik,"Kalasan, Sleman Kab., Yogyakarta D.I."
Rumah Baru Siap Huni Di Jalan Imogiri Barat Dekat Kota Jogja,400000000,85,60,2,1,1,SHM - Sertifikat Hak Milik,"Jetis, Bantul Kab., Yogyakarta D.I."
Rumah 2 lantai dekat Harjolukito di blok O,950000000,162,280,3,3,2,SHM - Sertifikat Hak Milik,"Banguntapan, Bantul Kab., Yogyakarta D.I."
PERUMAHAN MEWAH MULAI 900JUTAAN DEKAT KAMPUS UII - SMR285,900000000,131,70,3,3,2,SHM - Sertifikat Hak Milik,"Ngemplak, Sleman Kab., Yogyakarta D.I."
Saatnya Miliki Rumah Konsep Minimalis Bernuansa Putih Elegan 500jutaan,500000018,142,45,2,1,1,SHM - Sertifikat Hak Milik,"Tempel, Sleman Kab., Yogyakarta D.I."
DIJUAL MURAH RUMAH 2 LANTAI SEKITAR STADION SULTAN AGUNG,600000000,70,50,2,2,2,SHM - Sertifikat Hak Milik,"Bantul, Bantul Kab., Yogyakarta D.I."
Rumah Hook Strategis Dipinggir Jalan Aspal,660000000,86,50,2,1,1,SHM - Sertifikat Hak Milik,"Berbah, Sleman Kab., Yogyakarta D.I."
RUMAH MURAH STRATEGIS DI DEKAT KAMPUS UII JL KALIURANG SLEMAN YOGYA,585000000,178,180,3,2,1,SHM - Sertifikat Hak Milik,"Ngemplak, Sleman Kab., Yogyakarta D.I."
SMART HOME DESAIN SCANDINAVIAN DI BANTUL DEKAT KIDS FUN,910000000,108,90,3,2,2,SHM - Sertifikat Hak Milik,"Banguntapan, Bantul Kab., Yogyakarta D.I."
Rumah Baru Dalam Cluster JL Kabupaten Dalam Ring Road,1468000000,101,130,3,3,2,SHM - Sertifikat Hak Milik,"Gamping, Sleman Kab., Yogyakarta D.I."
Jual Rumah lokasi Strategis,700000000,111,50,2,2,1,SHM - Sertifikat Hak Milik,"Godean, Sleman Kab., Yogyakarta D.I."
"Rumah dijual, Rumah kosan eksklusif full penghuni, dekat Kampus UGM",900000000,70,70,5,5,2,SHM - Sertifikat Hak Milik,"Gamping, Sleman Kab., Yogyakarta D.I."
Rumah Baru dan Luas Dalam Ring Road JL Kabupaten,1550000000,130,129,3,3,2,SHM - Sertifikat Hak Milik,"Gamping, Sleman Kab., Yogyakarta D.I."
"RUMAH MINIMALIS 499JUTA SIAP BANGUN DEKAT PASAR GODEAN -
SMR 276",499000000,100,60,2,1,1,SHM - Sertifikat Hak Milik,"Godean, Sleman Kab., Yogyakarta D.I."
Dijual Hunian Idaman Strategis Hanya 200 Jutaan di Kulonprogo,225000000,113,40,2,2,1,SHM - Sertifikat Hak Milik,"Pengasih, Kulon Progo Kab., Yogyakarta D.I."
"Dijual Rumah Mewah Minimalis Dekat Ringroad, Sleman Yogyakarta",472500000,75,45,2,2,2,SHM - Sertifikat Hak Milik,"Gamping, Sleman Kab., Yogyakarta D.I."
Rumah full furnished di jln Besi-Jangkang - SMR 220,696000000,130,80,3,2,1,SHM - Sertifikat Hak Milik,"Ngaglik, Sleman Kab., Yogyakarta D.I."
Rumah baru di Pandanaran akses jalan 5 mtr dekat UII,795000000,105,71,3,2,0,SHM - Sertifikat Hak Milik,"Ngaglik, Sleman Kab., Yogyakarta D.I."
"Rumah Murah di Selatan Uii, Hanya 200 Juta-an",195000400,50,30,2,1,1,HGB - Hak Guna Bangun,"Ngaglik, Sleman Kab., Yogyakarta D.I."
"PERUMAHAN MODERN BARU DI JL. KALIURANG

-SMR 312",800000000,112,45,2,1,1,HGB - Hak Guna Bangun,"Ngaglik, Sleman Kab., Yogyakarta D.I."
"Rumah Termurah di Jakal, Siap Bangun 10 Unit",190002000,50,30,2,1,1,HGB - Hak Guna Bangun,"Ngaglik, Sleman Kab., Yogyakarta D.I."
Rumah dalam perumahan elit jalan palagan km 10,1700000000,205,80,3,3,2,SHM - Sertifikat Hak Milik,"Ngaglik, Sleman Kab., Yogyakarta D.I."
Oemah Joglo 312 m2 Besi Jangkang JL Kaliurang Sukoharjo Ngaglik,799000000,112,45,2,1,1,HGB - Hak Guna Bangun,"Ngaglik, Sleman Kab., Yogyakarta D.I."
"For SALE, Rumah Mewah di Utara Jogja Bay, One Gates System",1505000000,123,180,4,3,2,SHM - Sertifikat Hak Milik,"Ngemplak, Sleman Kab., Yogyakarta D.I."
Griya Perumahan Purwo Sleman Dkat JL Tajem Wedomartani Maguwoharjo,699000000,102,60,2,1,1,SHM - Sertifikat Hak Milik,"Kalasan, Sleman Kab., Yogyakarta D.I."
Rumah baru dekat UII jakal km 13 besi jangkang,775000000,135,80,3,2,1,SHM - Sertifikat Hak Milik,"Ngaglik, Sleman Kab., Yogyakarta D.I."
Rumah Modern Sertifikat SHM Dekat Pamela 7,553050000,107,45,2,1,0,SHM - Sertifikat Hak Milik,"Kalasan, Sleman Kab., Yogyakarta D.I."
Rumah Cantik Berkualitas Di Jalan Kaliurang Km 13 Dekat UGM,835000000,100,130,3,2,1,SHM - Sertifikat Hak Milik,"Ngaglik, Sleman Kab., Yogyakarta D.I."
Rumah Siap Huni Jual Cepat Di Sleman Legalitas SHM &amp; IMB Siap KPR,585000088,93,54,2,1,1,SHM - Sertifikat Hak Milik,"Ngemplak, Sleman Kab., Yogyakarta D.I."
Rumah Di Jalan Pandanaran Yogyakarta Luas dan Murah,800000001,140,73,3,2,1,SHM - Sertifikat Hak Milik,"Ngaglik, Sleman Kab., Yogyakarta D.I."
Rumah Mungil di Purwomartani Timur Perumahan Pertamina,585000001,129,90,3,2,1,SHM - Sertifikat Hak Milik,"Kalasan, Sleman Kab., Yogyakarta D.I."
MINIMALIS Terjangkau Hanya 5 Menit Kampus UII KALIURANG,575000000,87,60,3,2,2,SHM - Sertifikat Hak Milik,"Ngaglik, Sleman Kab., Yogyakarta D.I."
Rumah Strategis Lingkungan Perumahan di Jalan Kaliurang km 9,1500000000,100,90,3,3,1,SHM - Sertifikat Hak Milik,"Ngaglik, Sleman Kab., Yogyakarta D.I."
RUMAH MINIMALIS MODERN CANTIK DI JOGJA UTARA - SMR120,415000000,121,45,2,1,1,SHM - Sertifikat Hak Milik,"Tempel, Sleman Kab., Yogyakarta D.I."
Rumah Baru Lingkungan Padat 3 KM Dari Jogja Bay,550800000,108,45,2,1,1,SHM - Sertifikat Hak Milik,"Kalasan, Sleman Kab., Yogyakarta D.I."
"RUMAH KAVLING MODERN STRATEGIS DI SIDOARUM, GODEAN - SMR 100",830000000,151,90,3,2,1,SHM - Sertifikat Hak Milik,"Godean, Sleman Kab., Yogyakarta D.I."
Jual Rumah Siap Huni Di Sleman Harga Terjangkau Siap KPR,585000057,120,88,3,2,1,SHM - Sertifikat Hak Milik,"Ngemplak, Sleman Kab., Yogyakarta D.I."
Rumah Dijual LT:250 Perumahan Banteng Jl. Kaliurang Km. 7 dkt UGM,2900000000,150,140,5,3,2,SHM - Sertifikat Hak Milik,"Ngaglik, Sleman Kab., Yogyakarta D.I."
RUMAH BANGUNTAPAN POTORONO JL PLERET DEKAT KOTAGEDE UAD GIWANGAN JOGJA,510000000,90,37,2,1,1,SHM - Sertifikat Hak Milik,"Banguntapan, Bantul Kab., Yogyakarta D.I."
Kode RSH 191 # Rumah Cantik  baru Siap Huni di Karangasem Patalan Jeti,400000000,120,120,2,1,1,SHM - Sertifikat Hak Milik,"Jetis, Bantul Kab., Yogyakarta D.I."
RUMAH MEWAH MODERN STRATEGIS DEKAT JOGJA BAY - SMR 234,1500000000,97,150,5,3,2,SHM - Sertifikat Hak Milik,"Ngaglik, Sleman Kab., Yogyakarta D.I."
rumah 200an juta tipe 36 minimalis shm imb minggir sleman,295000000,108,36,2,1,0,SHM - Sertifikat Hak Milik,"Minggir, Sleman Kab., Yogyakarta D.I."
Rumah siap bangun lokasi strategis 50 m jln Godean km 15,425000000,130,36,2,1,1,SHM - Sertifikat Hak Milik,"Moyudan, Sleman Kab., Yogyakarta D.I."
"5 Menit Stasiun Wates, Luasan 137 m2",191800000,58,30,2,1,1,HGB - Hak Guna Bangun,"Wates, Kulon Progo Kab., Yogyakarta D.I."
Rumah Siap Huni di Jl Imogiri Barat KM 12 Jetis Bantul dkt Bantul Kota,325000005,85,60,2,1,1,SHM - Sertifikat Hak Milik,"Jetis, Bantul Kab., Yogyakarta D.I."
Rumah 200 Jutaan Murah Minimalis di Gaten Jetis Siap Bangun,250000222,60,36,2,1,1,SHM - Sertifikat Hak Milik,"Jetis, Bantul Kab., Yogyakarta D.I."
"Rumah 2 Lantai Dalam Cluster Di Klidon Sukoharjo, Dekat Kampus UII",1150000003,121,100,3,3,2,SHM - Sertifikat Hak Milik,"Ngaglik, Sleman Kab., Yogyakarta D.I."
"Rumah dijual dekat polsek bantul 580 juta siap huni di deresan, bantul",580000010,121,63,2,1,1,SHM - Sertifikat Hak Milik,"Bantul, Bantul Kab., Yogyakarta D.I."
Murah ! Rumah Baru dalam Perum di jl.imogiri dekat UAD Giwangan Jogja,776000000,88,76,3,2,2,SHM - Sertifikat Hak Milik,"Banguntapan, Bantul Kab., Yogyakarta D.I."
Rumah murah akses papasan dekat RS UII Pandak.1483,295000000,96,45,2,1,1,SHM - Sertifikat Hak Milik,"Pandak, Bantul Kab., Yogyakarta D.I."
Rumah Dekat Jl Imogiri Timur di Jetis Bantul Kota Akses Jalan Aspal,385000009,102,61,3,2,1,SHM - Sertifikat Hak Milik,"Jetis, Bantul Kab., Yogyakarta D.I."
"Siap Bangun Hunian Mewah Elit dgn Private Pool, Developer Patrajasa",4791440000,198,180,3,3,2,HGB - Hak Guna Bangun,"Ngaglik, Sleman Kab., Yogyakarta D.I."
Rumah pese. Bangun 5 unit sisa 4 unit di ngemplak jangkang sleman,375000000,64,36,2,1,1,SHM - Sertifikat Hak Milik,"Ngemplak, Sleman Kab., Yogyakarta D.I."
Kode : RSH 3240 #Rumah dan Warung Makan Strategis Siap Huni di Bangunt,1800000000,291,50,3,2,1,SHM - Sertifikat Hak Milik,"Banguntapan, Bantul Kab., Yogyakarta D.I."
Hunian Baru Banguntapan Tamanan Dekat JL Imogiri Timur UAD Giwangan,325000000,61,36,2,1,1,SHM - Sertifikat Hak Milik,"Banguntapan, Bantul Kab., Yogyakarta D.I."
Kost dijual Jogja di Jakal 5 menit ke Kampus UII Jalan Kaliurang KM 13,1900000000,150,120,10,10,1,SHM - Sertifikat Hak Milik,"Ngaglik, Sleman Kab., Yogyakarta D.I."
"Asri Sejuk Dekat Sungai, Daaru Tirta Hutama, Bebas Desain Fasad",328650000,79,38,2,1,1,SHM - Sertifikat Hak Milik,"Kalasan, Sleman Kab., Yogyakarta D.I."
Griya Nyaman Perum JL Turi Dkt JL Magelang Pandowoharjo Pangukan,675000000,120,58,2,1,1,SHM - Sertifikat Hak Milik,"Turi, Sleman Kab., Yogyakarta D.I."
Rumah Perum 3KT 2KM Sleman Margoluwih Seyegan Dekat TGP Godean Jogja,325000000,83,50,3,2,2,SHM - Sertifikat Hak Milik,"Godean, Sleman Kab., Yogyakarta D.I."
"NEGO Sampai Deal, Bisa Custom Layout Rumah, Tipe 36, Maguwoharjo",458000000,64,36,2,1,1,SHM - Sertifikat Hak Milik,"Ngemplak, Sleman Kab., Yogyakarta D.I."
Kode RSH 305 # Rumah Murah Bagus di Baturetno Banguntapan Bantul Yogya,350000000,56,38,2,1,1,SHM - Sertifikat Hak Milik,"Banguntapan, Bantul Kab., Yogyakarta D.I."
Rumah Kodya Dekat Kampus UST Taman Siswa,1450000000,72,130,3,2,3,SHM - Sertifikat Hak Milik,"Umbulharjo, Yogyakarta Kota, Yogyakarta D.I."
Rumah 2 lantai Fully Furnish di Karangmojo Purwomartani Kalasan Sleman,1300000000,136,95,3,2,2,SHM - Sertifikat Hak Milik,"Kalasan, Sleman Kab., Yogyakarta D.I."
Rumah 2 lantai Fully Furnish di Karangmojo Purwomartani Kalasan Sleman,1300000000,145,200,4,4,2,SHM - Sertifikat Hak Milik,"Kalasan, Sleman Kab., Yogyakarta D.I."
Rumah Siap Huni Hanya 5 Menit Ke UII Kaliurang!!,830000099,138,75,3,2,1,SHM - Sertifikat Hak Milik,"Ngaglik, Sleman Kab., Yogyakarta D.I."
Rumah Full furnish Siap Huni Dekat RS Nur Hidayah,870000221,177,85,3,3,1,SHM - Sertifikat Hak Milik,"Jetis, Bantul Kab., Yogyakarta D.I."
Dijual Rumah  Lokasi Utara Jogjabay Waterpark Maguwoharjo  Yogyaka,3400000000,327,327,5,4,2,SHM - Sertifikat Hak Milik,"Ngaglik, Sleman Kab., Yogyakarta D.I."
Rumah 2 lantai Laguna Spring jl wonosari banguntapan Bantul Yogyakarta,2500000000,128,115,3,2,2,HGB - Hak Guna Bangun,"Banguntapan, Bantul Kab., Yogyakarta D.I."
Rumah Mewah Include Private Pool Di Lokasi Premium Jogja Jakal Km 9,2299000000,203,150,4,3,1,SHM - Sertifikat Hak Milik,"Ngaglik, Sleman Kab., Yogyakarta D.I."
RUMAH 2 LANTAI BARU MODERN FULL FURNISH DI PURWOMARTANI SLEMAN YOGYA,1100000000,116,177,3,2,2,SHM - Sertifikat Hak Milik,"Kalasan, Sleman Kab., Yogyakarta D.I."
Rumah Murah dan Luas di Jalan Kaliurang Km 13 Dekat Kampus UII,570000000,135,52,2,1,1,SHM - Sertifikat Hak Milik,"Ngaglik, Sleman Kab., Yogyakarta D.I."
Dijual Rumah 3 Kamar tanah luas dekat Kampus UMY,495000000,102,45,2,1,1,SHM - Sertifikat Hak Milik,"Gamping, Sleman Kab., Yogyakarta D.I."
Rumah Dalam Ringroad Dekat Kampus UPY,550000000,92,45,2,1,1,SHM - Sertifikat Hak Milik,"Gamping, Sleman Kab., Yogyakarta D.I."
Rumah Hook Lingkungan Perumahan dekat Jalan Lempongsari,1400000000,118,120,3,2,2,SHM - Sertifikat Hak Milik,"Ngaglik, Sleman Kab., Yogyakarta D.I."
Dijual Rumah Halaman Luas Full Furnished Dengan Kolam Renang Pribadi,3000000000,765,765,5,3,1,SHM - Sertifikat Hak Milik,"Ngaglik, Sleman Kab., Yogyakarta D.I."
Dijual Rumah Mewah Baru Siap Huni Dalam Perumahan Di Jl Palagan,1700000000,144,125,4,3,2,SHM - Sertifikat Hak Milik,"Ngaglik, Sleman Kab., Yogyakarta D.I."
Launching!! Selatan Perum Pertamina Perumahan Konsep Modern Purwo,873000990,118,70,3,2,1,SHM - Sertifikat Hak Milik,"Sleman, Sleman Kab., Yogyakarta D.I."
Dijual rumah minimalis siap huni di daerah gamping ringroad barat,800000000,141,55,2,1,1,SHM - Sertifikat Hak Milik,"Sleman, Sleman Kab., Yogyakarta D.I."
Murah! Perumahan Modern Konsep Eropa Dekat Kids Fun,650009900,209,100,3,2,1,SHM - Sertifikat Hak Milik,"Sleman, Sleman Kab., Yogyakarta D.I."
"Tanah Sleman Murah, Sertipikat SHM, Dekat UII",450000000,107,45,2,1,1,SHM - Sertifikat Hak Milik,"Sleman, Sleman Kab., Yogyakarta D.I."
"Kost Jogja 2 lantai, 11 Kamar. Pogung Baru. dekat ke kampus UGM. SHM",3950000000,333,200,5,3,1,SHM - Sertifikat Hak Milik,"Sleman, Sleman Kab., Yogyakarta D.I."
900jt-an Dapat Rumah 2 Lantai Mewah Sebelah Barat Jalan Magelang,975000008,115,100,4,2,2,SHM - Sertifikat Hak Milik,"Mlati, Sleman Kab., Yogyakarta D.I."
"Rumah Mewah Baru di Jalan kaliurang Km 8,5 Akses Jalan Besar",2700000000,252,200,5,3,2,SHM - Sertifikat Hak Milik,"Sleman, Sleman Kab., Yogyakarta D.I."
Rumah Dekat Jombor Di Mlati Seyegan Murah 600 Jutaan Dekat Pemda,675000000,90,60,3,2,1,SHM - Sertifikat Hak Milik,"Mlati, Sleman Kab., Yogyakarta D.I."
Rumah Minimalis Full Furnished dlm Perumahan Jongke Security 24 Jam,1400000000,132,90,3,3,1,SHM - Sertifikat Hak Milik,"Mlati, Sleman Kab., Yogyakarta D.I."
"Berkah Ramadhan,Segera Dapatkan Rumah Hanya 500jt-an di Tridadi Sleman",520000005,87,36,2,1,1,SHM - Sertifikat Hak Milik,"Mlati, Sleman Kab., Yogyakarta D.I."
Perumahan Baru Griya Sentosa Utara Jombor,1800000000,137,155,5,4,2,HGB - Hak Guna Bangun,"Mlati, Sleman Kab., Yogyakarta D.I."
"Akses Mobil Masuk, Hunian Area Pundong I, Dekat Jl. Kebon Agung",440000000,87,36,2,1,1,SHM - Sertifikat Hak Milik,"Mlati, Sleman Kab., Yogyakarta D.I."
Murah siap huni di Maguwoharjo Depok sleman,695000000,100,65,3,2,1,SHM - Sertifikat Hak Milik,"Mlati, Sleman Kab., Yogyakarta D.I."
Rumah Mewah Hook Perum Elite Nandan Griya Idaman Dekat Al Azhar &amp; UGM,3750000000,235,269,5,4,2,SHM - Sertifikat Hak Milik,"Mlati, Sleman Kab., Yogyakarta D.I."
Rumah Baru Belakang Gor Pangukan Siap Bangun,585000000,133,50,2,1,1,SHM - Sertifikat Hak Milik,"Sleman, Sleman Kab., Yogyakarta D.I."
"Rumah view persawahan ,jln kabupaten trihanggo gamping sleman",1300000000,178,100,3,2,1,SHM - Sertifikat Hak Milik,"Mlati, Sleman Kab., Yogyakarta D.I."
Rumah Mewah Perumahan Bale Mulia Dengan Kolam Renang Pribadi,10000000000,527,399,5,4,2,HGB - Hak Guna Bangun,"Mlati, Sleman Kab., Yogyakarta D.I."
Rumah mewah di Bale Mulia residence Mlati Sleman Yogyakarta,4600000000,252,253,5,4,1,HGB - Hak Guna Bangun,"Mlati, Sleman Kab., Yogyakarta D.I."
"Dijual Rumah di Jombor Mlati Sleman, Barat Monjali dekat YIS",1600000000,292,320,7,5,2,SHM - Sertifikat Hak Milik,"Mlati, Sleman Kab., Yogyakarta D.I."
Rumah Baru Murah di Tlogoadi dekat RSA UGM UTY Jombor,495000000,90,45,2,1,1,SHM - Sertifikat Hak Milik,"Mlati, Sleman Kab., Yogyakarta D.I."
Rumah mewah di bale mulia dkt ugm uty rs sarjito jcm sch tvri unisa(rb,4400000000,293,323,4,3,2,HGB - Hak Guna Bangun,"Mlati, Sleman Kab., Yogyakarta D.I."
Rumah Dijual Mewah Hook 2 Muka Bale Mulia Residence Perumahan Elite,5300000000,252,260,5,4,2,HGB - Hak Guna Bangun,"Mlati, Sleman Kab., Yogyakarta D.I."
Rumah mewah di bale mulia dkt ugm uty rs sarjito jcm sch tvri unisa(rb,4400000000,322,297,5,4,2,HGB - Hak Guna Bangun,"Mlati, Sleman Kab., Yogyakarta D.I."
Rumah Dijual Bale Mulia Residence Perumahan Mewah Lingkungan Elite,4200000000,313,260,5,5,2,HGB - Hak Guna Bangun,"Mlati, Sleman Kab., Yogyakarta D.I."
RUMAH DI JALAN MAGELANG MLATI SLEMAN DEKAT TERMINAL JOMBOR DAN JCM,1000000000,114,180,5,3,2,SHM - Sertifikat Hak Milik,"Mlati, Sleman Kab., Yogyakarta D.I."
Rumah Mewah Dan Kost 15 Kamar Jalan Utama Pogung Jl. Kaliurang Km. 4,4499000000,220,225,8,9,2,SHM - Sertifikat Hak Milik,"Mlati, Sleman Kab., Yogyakarta D.I."
Harga Dibawah Pasaran di Bale Mulia Barat Terminal Jombor Jogja,1650000000,164,110,3,1,2,SHM - Sertifikat Hak Milik,"Mlati, Sleman Kab., Yogyakarta D.I."
Rumah 2 lantai dekat kota yogya,474999999,135,55,3,1,1,SHM - Sertifikat Hak Milik,"Mlati, Sleman Kab., Yogyakarta D.I."
RUMAH MURAH CLUSTER STRATEGIS DI JL JONGKE MLATI MAGELANG SLEMAN YOGYA,950000000,140,90,3,2,1,SHM - Sertifikat Hak Milik,"Mlati, Sleman Kab., Yogyakarta D.I."
RUMAH MURAH STRATEGIS DEKAT PEMDA DAN JL MAGELANG KM 13 SLEMAN YOGYA,335000000,120,80,2,2,1,SHM - Sertifikat Hak Milik,"Sleman, Sleman Kab., Yogyakarta D.I."
Kode RSH835 #Rumah Cantik Barat Perum Grand Tlogoadi Mlati Sleman Yogy,700000000,170,165,3,4,2,SHM - Sertifikat Hak Milik,"Mlati, Sleman Kab., Yogyakarta D.I."
Rumah Dalam Perum Sleman Jalan Griya Taman Asri,650000000,130,80,4,2,2,SHM - Sertifikat Hak Milik,"Sleman, Sleman Kab., Yogyakarta D.I."
Rumah Siap Huni dekat SMP 1 Seyegan,480000000,108,70,2,1,1,SHM - Sertifikat Hak Milik,"Seyegan, Sleman Kab., Yogyakarta D.I."
Dijual Rumah Siap Huni dlm Perumahan Didkt Banyumili Resto,999000000,106,70,3,2,1,SHM - Sertifikat Hak Milik,"Sleman, Sleman Kab., Yogyakarta D.I."
"Perumahan Dekat UGM, UII Jogja",2100000000,127,150,4,3,2,SHM - Sertifikat Hak Milik,"Mlati, Sleman Kab., Yogyakarta D.I."
Rumah Dijual Cepat Jl Padma Dalam Perumahan Belakang Hotel Hyatt,1400000000,131,160,4,3,2,SHM - Sertifikat Hak Milik,"Mlati, Sleman Kab., Yogyakarta D.I."
Rumah Baru Modern Siap Huni Strategis Di Mlati Sleman,495000000,90,45,2,1,1,SHM - Sertifikat Hak Milik,"Mlati, Sleman Kab., Yogyakarta D.I."
"MURAH! RUMAH BARU SIAP HUNI DI PURWOMARTANI,SLEMAN,JOGJA",725000000,129,80,2,2,1,SHM - Sertifikat Hak Milik,"Mlati, Sleman Kab., Yogyakarta D.I."
RUMAH BARU 3 KAMAR SIAP HUNI AREA MLATI DEKAT JL PURBAYA. JK10334,700000004,100,70,3,2,1,SHM - Sertifikat Hak Milik,"Mlati, Sleman Kab., Yogyakarta D.I."
Rumah Murah Jawa Etnik dekat RS At Tourots Seyegan,750500200,131,80,3,2,1,SHM - Sertifikat Hak Milik,"Mlati, Sleman Kab., Yogyakarta D.I."
Rumah baru minimalis di jln godean km 6.5 dkt ke bakmi pak pele,850000000,174,100,3,2,1,SHM - Sertifikat Hak Milik,"Mlati, Sleman Kab., Yogyakarta D.I."
Rumah Baru Siap Huni Dekat SMAN 1 Seyegan Sleman,385000001,110,50,3,1,1,SHM - Sertifikat Hak Milik,"Mlati, Sleman Kab., Yogyakarta D.I."
Rumah Murah Jogja Barat dekat pasar Ngino,325000100,100,50,2,1,1,SHM - Sertifikat Hak Milik,"Mlati, Sleman Kab., Yogyakarta D.I."
Rumah Mewah 2 Lantai Siap Huni Dekat Terminal Jombor Jl Magelang,2250000000,137,155,3,2,1,SHM - Sertifikat Hak Milik,"Mlati, Sleman Kab., Yogyakarta D.I."
Rumah Mewah Hook Perum Elite Nandan Griya Idaman Dekat Al Azhar &amp; UGM,3750000000,206,240,4,3,2,SHM - Sertifikat Hak Milik,"Mlati, Sleman Kab., Yogyakarta D.I."
Turun Harga Rumah Mewah Hyarta Residence,4666000000,180,220,4,3,2,HGB - Hak Guna Bangun,"Mlati, Sleman Kab., Yogyakarta D.I."
Dijual Rumah dan Ruang Usaha di Kompel Perkantoran Pemda Sleman,3000000000,363,400,3,5,2,SHM - Sertifikat Hak Milik,"Sleman, Sleman Kab., Yogyakarta D.I."
"BARU! Rumah Mewah Minimalis 2 Lantai Dekat Ringroad, Sleman Yogyakarta",472000000,74,45,2,2,2,SHM - Sertifikat Hak Milik,"Sleman, Sleman Kab., Yogyakarta D.I."
Griya Baru Kavling 3KT 2KM Sleman Sumberadi Mlati Dekat Warak Cebongan,699000000,118,50,2,1,1,SHM - Sertifikat Hak Milik,"Mlati, Sleman Kab., Yogyakarta D.I."
Rumah bagus dalam perumahan di belakang Hyaat jl Padma Palagan Yogya,1400000000,110,100,3,2,2,SHM - Sertifikat Hak Milik,"Mlati, Sleman Kab., Yogyakarta D.I."
Dijual Rumah strategis pinggir jalan aspal dekat kampus UNISA,700000000,188,170,8,2,1,SHM - Sertifikat Hak Milik,"Mlati, Sleman Kab., Yogyakarta D.I."
Tanah Murah Sleman Legalitas SHM,325000000,90,40,2,1,1,SHM - Sertifikat Hak Milik,"Sleman, Sleman Kab., Yogyakarta D.I."
KAVLING SIAP BANGUN LOKASI STRATEGIS HARGA MURAH,450000000,101,36,2,1,1,SHM - Sertifikat Hak Milik,"Mlati, Sleman Kab., Yogyakarta D.I."
"Kapling 1 Jt-an Jogja Barat, Kawasan Industri Sentolo",150000000,52,52,2,1,0,HGB - Hak Guna Bangun,"Mlati, Sleman Kab., Yogyakarta D.I."
Rumah Design Scandinavian 300 Jutaan,375980500,88,40,2,1,0,HGB - Hak Guna Bangun,"Sleman, Sleman Kab., Yogyakarta D.I."
Kode : RSH 3266 #Rumah Cantik 2 Lantai Full Furnished di Dekat Kampus,1200000000,110,186,5,2,2,SHM - Sertifikat Hak Milik,"Mlati, Sleman Kab., Yogyakarta D.I."
"Griya Tirta Hutama 3, Unit Area Pundong, Mlati, Dekat SPBU Cebongan",440200000,87,36,2,1,1,SHM - Sertifikat Hak Milik,"Mlati, Sleman Kab., Yogyakarta D.I."
